seasonType,eventId,playOrder,playId,typeId,text,shortText,period,clockValue,clockDisplayValue,teamId,scoringPlay,shootout,wallclock,goalPositionX,goalPositionY,fieldpositionX,fieldPositionY,fieldPosition2X,fieldPosition2Y,athleteId,participant,updateDateTime
13145,727692,1,45308909,70,Kasper Waarst Høgh (Bodo/Glimt) Goal at 4',Kasper Waarst Høgh Goal,1,240,4',2980,0,0,1980-01-01,0.0,0.0,0.0,0.0,0.0,0.0,272624,Kasper Waarst Høgh,2025-05-28 04:50:34
13145,727692,2,45308970,94,Patrick Berg (Bodo/Glimt) Yellow Card at 9',Patrick Berg Yellow Card,1,540,9',2980,0,0,1980-01-01,0.0,0.0,0.0,0.0,0.0,0.0,205924,Patrick Berg,2025-05-28 04:50:34
13145,727692,3,45309017,70,Ole Didrik Blomberg (Bodo/Glimt) Goal at 18',Ole Didrik Blomberg Goal,1,1080,18',2980,0,0,1980-01-01,0.0,0.0,0.0,0.0,0.0,0.0,307798,Ole Didrik Blomberg,2025-05-28 04:50:34
13145,727692,4,45309166,70,Ole Didrik Blomberg (Bodo/Glimt) Goal at 39',Ole Didrik Blomberg Goal,1,2340,39',2980,0,0,1980-01-01,0.0,0.0,0.0,0.0,0.0,0.0,307798,Ole Didrik Blomberg,2025-05-28 04:50:34
13145,727692,5,45309339,76,Ole Christian Saeter (Rosenborg) Substitution at 45',Ole Christian Saeter Substitutio,2,2700,45',438,0,0,1980-01-01,0.0,0.0,0.0,0.0,0.0,0.0,312949,Ole Christian Saeter,2025-05-28 04:50:34
13145,727692,5,45309339,76,Ole Christian Saeter (Rosenborg) Substitution at 45',Ole Christian Saeter Substitutio,2,2700,45',438,0,0,1980-01-01,0.0,0.0,0.0,0.0,0.0,0.0,186078,Iver Fossum,2025-05-28 04:50:34
13145,727692,6,45309399,70,Ulrik Saltnes (Bodo/Glimt) Goal at 52',Ulrik Saltnes Goal,2,3120,52',2980,0,0,1980-01-01,0.0,0.0,0.0,0.0,0.0,0.0,203670,Ulrik Saltnes,2025-05-28 04:50:34
13145,727692,7,45309458,94,Fredrik Sjøvold (Bodo/Glimt) Yellow Card at 57',Fredrik Sjøvold Yellow Card,2,3420,57',2980,0,0,1980-01-01,0.0,0.0,0.0,0.0,0.0,0.0,333755,Fredrik Sjøvold,2025-05-28 04:50:34
13145,727692,8,45309536,76,Sondre Auklend (Bodo/Glimt) Substitution at 68',Sondre Auklend Substitution,2,4080,68',2980,0,0,1980-01-01,0.0,0.0,0.0,0.0,0.0,0.0,303740,Sondre Auklend,2025-05-28 04:50:34
13145,727692,9,45309551,76,Isak Dybvik Määttä (Bodo/Glimt) Substitution at 68',Isak Dybvik Määttä Substitution,2,4080,68',2980,0,0,1980-01-01,0.0,0.0,0.0,0.0,0.0,0.0,302019,Isak Dybvik Määttä,2025-05-28 04:50:34
13145,727692,8,45309536,76,Sondre Auklend (Bodo/Glimt) Substitution at 68',Sondre Auklend Substitution,2,4080,68',2980,0,0,1980-01-01,0.0,0.0,0.0,0.0,0.0,0.0,271088,Hakon Evjen,2025-05-28 04:50:34
13145,727692,9,45309551,76,Isak Dybvik Määttä (Bodo/Glimt) Substitution at 68',Isak Dybvik Määttä Substitution,2,4080,68',2980,0,0,1980-01-01,0.0,0.0,0.0,0.0,0.0,0.0,235789,Jens Hauge,2025-05-28 04:50:34
13145,727692,10,45309566,94,Emil Konradsen Ceide (Rosenborg) Yellow Card at 70',Emil Konradsen Ceide Yellow Card,2,4200,70',438,0,0,1980-01-01,0.0,0.0,0.0,0.0,0.0,0.0,275113,Emil Konradsen Ceide,2025-05-28 04:50:34
13145,727692,11,45309599,76,Andreas Helmersen (Bodo/Glimt) Substitution at 76',Andreas Helmersen Substitution,2,4560,76',2980,0,0,1980-01-01,0.0,0.0,0.0,0.0,0.0,0.0,218561,Andreas Helmersen,2025-05-28 04:50:34
13145,727692,11,45309599,76,Andreas Helmersen (Bodo/Glimt) Substitution at 76',Andreas Helmersen Substitution,2,4560,76',2980,0,0,1980-01-01,0.0,0.0,0.0,0.0,0.0,0.0,272624,Kasper Waarst Høgh,2025-05-28 04:50:34
13145,727692,12,45309623,76,Moustafa Zeidan (Rosenborg) Substitution at 79',Moustafa Zeidan Substitution,2,4740,79',438,0,0,1980-01-01,0.0,0.0,0.0,0.0,0.0,0.0,238428,Moustafa Zeidan,2025-05-28 04:50:34
13145,727692,12,45309623,76,Moustafa Zeidan (Rosenborg) Substitution at 79',Moustafa Zeidan Substitution,2,4740,79',438,0,0,1980-01-01,0.0,0.0,0.0,0.0,0.0,0.0,334109,Sverre Nypan,2025-05-28 04:50:34
13145,727692,13,45309683,76,Jeppe Kjaer Jensen (Bodo/Glimt) Substitution at 82',Jeppe Kjaer Jensen Substitution,2,4920,82',2980,0,0,1980-01-01,0.0,0.0,0.0,0.0,0.0,0.0,305758,Jeppe Kjaer Jensen,2025-05-28 04:50:34
13145,727692,14,45309684,76,Odin Bjortuft (Bodo/Glimt) Substitution at 82',Odin Bjortuft Substitution,2,4920,82',2980,0,0,1980-01-01,0.0,0.0,0.0,0.0,0.0,0.0,269732,Odin Bjortuft,2025-05-28 04:50:34
13145,727692,13,45309683,76,Jeppe Kjaer Jensen (Bodo/Glimt) Substitution at 82',Jeppe Kjaer Jensen Substitution,2,4920,82',2980,0,0,1980-01-01,0.0,0.0,0.0,0.0,0.0,0.0,203670,Ulrik Saltnes,2025-05-28 04:50:34
13145,727692,14,45309684,76,Odin Bjortuft (Bodo/Glimt) Substitution at 82',Odin Bjortuft Substitution,2,4920,82',2980,0,0,1980-01-01,0.0,0.0,0.0,0.0,0.0,0.0,176883,Haitam Aleesami,2025-05-28 04:50:34
13145,727692,15,45309685,76,Isak Thorvaldsson (Rosenborg) Substitution at 83',Isak Thorvaldsson Substitution,2,4980,83',438,0,0,1980-01-01,0.0,0.0,0.0,0.0,0.0,0.0,295807,Isak Thorvaldsson,2025-05-28 04:50:34
13145,727692,15,45309685,76,Isak Thorvaldsson (Rosenborg) Substitution at 83',Isak Thorvaldsson Substitution,2,4980,83',438,0,0,1980-01-01,0.0,0.0,0.0,0.0,0.0,0.0,277007,Noah Jean Holm,2025-05-28 04:50:34
13145,727692,16,45309704,76,Ulrik Jenssen (Rosenborg) Substitution at 86',Ulrik Jenssen Substitution,2,5160,86',438,0,0,1980-01-01,0.0,0.0,0.0,0.0,0.0,0.0,222439,Ulrik Jenssen,2025-05-28 04:50:34
13145,727692,16,45309704,76,Ulrik Jenssen (Rosenborg) Substitution at 86',Ulrik Jenssen Substitution,2,5160,86',438,0,0,1980-01-01,0.0,0.0,0.0,0.0,0.0,0.0,304964,Tomas Nemcik,2025-05-28 04:50:34
13145,727694,1,45317538,70,Evangelos Patoulidis (Sandefjord) Goal at 17',Evangelos Patoulidis Goal,1,1020,17',3279,0,0,1980-01-01,0.0,0.0,0.0,0.0,0.0,0.0,277057,Evangelos Patoulidis,2025-05-28 04:50:34
13145,727694,2,45318146,70,Darrell Tibell (Sandefjord) Goal at 46',Darrell Tibell Goal,1,2700,45'+1',3279,0,0,1980-01-01,0.0,0.0,0.0,0.0,0.0,0.0,316022,Darrell Tibell,2025-05-28 04:50:34
13145,727694,3,45318301,76,Fredrik Ardraa (Stromsgodset) Substitution at 45',Fredrik Ardraa Substitution,2,2700,45',9811,0,0,1980-01-01,0.0,0.0,0.0,0.0,0.0,0.0,383882,Fredrik Ardraa,2025-05-28 04:50:34
13145,727694,3,45318301,76,Fredrik Ardraa (Stromsgodset) Substitution at 45',Fredrik Ardraa Substitution,2,2700,45',9811,0,0,1980-01-01,0.0,0.0,0.0,0.0,0.0,0.0,235135,Marcus Johnson-Mehnert,2025-05-28 04:50:34
13145,727694,4,45318334,70,Jakob Dunsby (Sandefjord) Goal at 49',Jakob Dunsby Goal,2,2940,49',3279,0,0,1980-01-01,0.0,0.0,0.0,0.0,0.0,0.0,290108,Jakob Dunsby,2025-05-28 04:50:34
13145,727694,5,45318422,70,Herman Stengel (Stromsgodset) Goal at 52',Herman Stengel Goal,2,3120,52',9811,0,0,1980-01-01,0.0,0.0,0.0,0.0,0.0,0.0,166628,Herman Stengel,2025-05-28 04:50:34
13145,727694,6,45318652,70,Jonas Therkelsen (Stromsgodset) Goal at 60',Jonas Therkelsen Goal,2,3600,60',9811,0,0,1980-01-01,0.0,0.0,0.0,0.0,0.0,0.0,343805,Jonas Therkelsen,2025-05-28 04:50:34
13145,727694,7,45318705,94,Darrell Tibell (Sandefjord) Yellow Card at 63',Darrell Tibell Yellow Card,2,3780,63',3279,0,0,1980-01-01,0.0,0.0,0.0,0.0,0.0,0.0,316022,Darrell Tibell,2025-05-28 04:50:34
13145,727694,8,45318832,94,Sander Mork (Sandefjord) Yellow Card at 68',Sander Mork Yellow Card,2,4080,68',3279,0,0,1980-01-01,0.0,0.0,0.0,0.0,0.0,0.0,281365,Sander Mork,2025-05-28 04:50:34
13145,727694,9,45318952,76,Elias Jemal (Sandefjord) Substitution at 76',Elias Jemal Substitution,2,4560,76',3279,0,0,1980-01-01,0.0,0.0,0.0,0.0,0.0,0.0,388439,Elias Jemal,2025-05-28 04:50:34
13145,727694,9,45318952,76,Elias Jemal (Sandefjord) Substitution at 76',Elias Jemal Substitution,2,4560,76',3279,0,0,1980-01-01,0.0,0.0,0.0,0.0,0.0,0.0,316022,Darrell Tibell,2025-05-28 04:50:34
13145,727694,10,45319094,76,Samuel Silalahi (Stromsgodset) Substitution at 81',Samuel Silalahi Substitution,2,4860,81',9811,0,0,1980-01-01,0.0,0.0,0.0,0.0,0.0,0.0,352557,Samuel Silalahi,2025-05-28 04:50:34
13145,727694,10,45319094,76,Samuel Silalahi (Stromsgodset) Substitution at 81',Samuel Silalahi Substitution,2,4860,81',9811,0,0,1980-01-01,0.0,0.0,0.0,0.0,0.0,0.0,303103,Kreshnik Krasniqi,2025-05-28 04:50:34
13145,727694,11,45319251,76,Loris Mettler (Sandefjord) Substitution at 89',Loris Mettler Substitution,2,5340,89',3279,0,0,1980-01-01,0.0,0.0,0.0,0.0,0.0,0.0,354454,Loris Mettler,2025-05-28 04:50:34
13145,727694,11,45319251,76,Loris Mettler (Sandefjord) Substitution at 89',Loris Mettler Substitution,2,5340,89',3279,0,0,1980-01-01,0.0,0.0,0.0,0.0,0.0,0.0,379168,Marcus Melchior,2025-05-28 04:50:34
13145,727694,12,45319401,76,Aleksander Van Der Spa (Sandefjord) Substitution at 94',Aleksander Van Der Spa Substitut,2,5400,90'+4',3279,0,0,1980-01-01,0.0,0.0,0.0,0.0,0.0,0.0,362832,Aleksander Van Der Spa,2025-05-28 04:50:34
13145,727694,12,45319401,76,Aleksander Van Der Spa (Sandefjord) Substitution at 94',Aleksander Van Der Spa Substitut,2,5400,90'+4',3279,0,0,1980-01-01,0.0,0.0,0.0,0.0,0.0,0.0,277057,Evangelos Patoulidis,2025-05-28 04:50:34
13145,727695,1,45317754,94,Martin Håheim-Elveseter (Sarpsborg FK) Yellow Card at 28',Martin Håheim-Elveseter Yellow C,1,1680,28',5002,0,0,1980-01-01,0.0,0.0,0.0,0.0,0.0,0.0,390698,Martin Håheim-Elveseter,2025-05-28 04:50:34
13145,727695,2,45318033,94,Alagie Sanyang (Sarpsborg FK) Yellow Card at 39',Alagie Sanyang Yellow Card,1,2340,39',5002,0,0,1980-01-01,0.0,0.0,0.0,0.0,0.0,0.0,387783,Alagie Sanyang,2025-05-28 04:50:34
13145,727695,3,45318175,94,David Edvardsson (Tromso) Yellow Card at 46',David Edvardsson Yellow Card,1,2700,45'+1',5270,0,0,1980-01-01,0.0,0.0,0.0,0.0,0.0,0.0,312875,David Edvardsson,2025-05-28 04:50:34
13145,727695,4,45318350,76,Peter Reinhardsen (Sarpsborg FK) Substitution at 45',Peter Reinhardsen Substitution,2,2700,45',5002,0,0,1980-01-01,0.0,0.0,0.0,0.0,0.0,0.0,356987,Peter Reinhardsen,2025-05-28 04:50:34
13145,727695,4,45318350,76,Peter Reinhardsen (Sarpsborg FK) Substitution at 45',Peter Reinhardsen Substitution,2,2700,45',5002,0,0,1980-01-01,0.0,0.0,0.0,0.0,0.0,0.0,390698,Martin Håheim-Elveseter,2025-05-28 04:50:34
13145,727695,5,45318709,76,Sander Christiansen (Sarpsborg FK) Substitution at 63',Sander Christiansen Substitution,2,3780,63',5002,0,0,1980-01-01,0.0,0.0,0.0,0.0,0.0,0.0,347328,Sander Christiansen,2025-05-28 04:50:34
13145,727695,5,45318709,76,Sander Christiansen (Sarpsborg FK) Substitution at 63',Sander Christiansen Substitution,2,3780,63',5002,0,0,1980-01-01,0.0,0.0,0.0,0.0,0.0,0.0,258016,Sveinn Aron Gudjohnsen,2025-05-28 04:50:34
13145,727695,6,45318756,76,Kent-Are Antonsen (Tromso) Substitution at 64',Kent-Are Antonsen Substitution,2,3840,64',5270,0,0,1980-01-01,0.0,0.0,0.0,0.0,0.0,0.0,187920,Kent-Are Antonsen,2025-05-28 04:50:34
13145,727695,7,45318757,76,Ieltsin Camões (Tromso) Substitution at 64',Ieltsin Camões Substitution,2,3840,64',5270,0,0,1980-01-01,0.0,0.0,0.0,0.0,0.0,0.0,400376,Ieltsin Camões,2025-05-31 04:50:33
13145,727695,6,45318756,76,Kent-Are Antonsen (Tromso) Substitution at 64',Kent-Are Antonsen Substitution,2,3840,64',5270,0,0,1980-01-01,0.0,0.0,0.0,0.0,0.0,0.0,312875,David Edvardsson,2025-05-28 04:50:34
13145,727695,7,45318757,76,Ieltsin Camões (Tromso) Substitution at 64',Ieltsin Camões Substitution,2,3840,64',5270,0,0,1980-01-01,0.0,0.0,0.0,0.0,0.0,0.0,285947,August Mikkelsen,2025-05-31 04:50:33
13145,727695,8,45318864,94,Harald Nilsen Tangen (Sarpsborg FK) Yellow Card at 70',Harald Nilsen Tangen Yellow Card,2,4200,70',5002,0,0,1980-01-01,0.0,0.0,0.0,0.0,0.0,0.0,259194,Harald Nilsen Tangen,2025-05-28 04:50:34
13145,727695,9,45318956,70,Ieltsin Camões (Tromso) Goal at 74',Ieltsin Camões Goal,2,4440,74',5270,0,0,1980-01-01,0.0,0.0,0.0,0.0,0.0,0.0,400376,Ieltsin Camões,2025-05-28 04:50:34
13145,727695,10,45319047,76,Yaw Paintsil (Tromso) Substitution at 78',Yaw Paintsil Substitution,2,4680,78',5270,0,0,1980-01-01,0.0,0.0,0.0,0.0,0.0,0.0,358392,Yaw Paintsil,2025-05-28 04:50:34
13145,727695,10,45319047,76,Yaw Paintsil (Tromso) Substitution at 78',Yaw Paintsil Substitution,2,4680,78',5270,0,0,1980-01-01,0.0,0.0,0.0,0.0,0.0,0.0,312960,Runar Norheim,2025-05-28 04:50:34
13145,727695,11,45319124,76,Jo Inge Berget (Sarpsborg FK) Substitution at 80',Jo Inge Berget Substitution,2,4800,80',5002,0,0,1980-01-01,0.0,0.0,0.0,0.0,0.0,0.0,129292,Jo Inge Berget,2025-05-28 04:50:34
13145,727695,12,45319146,76,Magnar Odegaard (Sarpsborg FK) Substitution at 80',Magnar Odegaard Substitution,2,4800,80',5002,0,0,1980-01-01,0.0,0.0,0.0,0.0,0.0,0.0,191982,Magnar Odegaard,2025-05-28 04:50:34
13145,727695,11,45319124,76,Jo Inge Berget (Sarpsborg FK) Substitution at 80',Jo Inge Berget Substitution,2,4800,80',5002,0,0,1980-01-01,0.0,0.0,0.0,0.0,0.0,0.0,379133,Victor Halvorsen,2025-05-28 04:50:34
13145,727695,12,45319146,76,Magnar Odegaard (Sarpsborg FK) Substitution at 80',Magnar Odegaard Substitution,2,4800,80',5002,0,0,1980-01-01,0.0,0.0,0.0,0.0,0.0,0.0,238488,Mohanad Jeahze,2025-05-28 04:50:34
13145,727695,13,45319199,76,Daniel Braut (Tromso) Substitution at 85',Daniel Braut Substitution,2,5100,85',5270,0,0,1980-01-01,0.0,0.0,0.0,0.0,0.0,0.0,387436,Daniel Braut,2025-05-28 04:50:34
13145,727695,13,45319199,76,Daniel Braut (Tromso) Substitution at 85',Daniel Braut Substitution,2,5100,85',5270,0,0,1980-01-01,0.0,0.0,0.0,0.0,0.0,0.0,293362,Vegard Østraat Erlien,2025-05-28 04:50:34
13145,727695,14,45319328,76,Mike Vestergård (Sarpsborg FK) Substitution at 91',Mike Vestergård Substitution,2,5400,90'+1',5002,0,0,1980-01-01,0.0,0.0,0.0,0.0,0.0,0.0,400089,Mike Vestergård,2025-05-28 04:50:34
13145,727695,14,45319328,76,Mike Vestergård (Sarpsborg FK) Substitution at 91',Mike Vestergård Substitution,2,5400,90'+1',5002,0,0,1980-01-01,0.0,0.0,0.0,0.0,0.0,0.0,287723,Aimar Sher,2025-05-28 04:50:34
13145,727696,1,45317482,94,Zlatko Tripic (Viking FK) Yellow Card at 12',Zlatko Tripic Yellow Card,1,720,12',510,0,0,1980-01-01,0.0,0.0,0.0,0.0,0.0,0.0,164279,Zlatko Tripic,2025-05-28 04:50:34
13145,727696,2,45317970,76,Mustapha Ubandoma (Kristiansund BK) Substitution at 38',Mustapha Ubandoma Substitution,1,2280,38',6672,0,0,1980-01-01,0.0,0.0,0.0,0.0,0.0,0.0,351346,Mustapha Ubandoma,2025-05-28 04:50:34
13145,727696,2,45317970,76,Mustapha Ubandoma (Kristiansund BK) Substitution at 38',Mustapha Ubandoma Substitution,1,2280,38',6672,0,0,1980-01-01,0.0,0.0,0.0,0.0,0.0,0.0,295559,Alioune Ndour,2025-05-28 04:50:34
13145,727696,3,45318007,94,Jost Urbancic (Viking FK) Yellow Card at 41',Jost Urbancic Yellow Card,1,2460,41',510,0,0,1980-01-01,0.0,0.0,0.0,0.0,0.0,0.0,276089,Jost Urbancic,2025-05-28 04:50:34
13145,727696,4,45318264,76,Vetle Auklend (Viking FK) Substitution at 45',Vetle Auklend Substitution,2,2700,45',510,0,0,1980-01-01,0.0,0.0,0.0,0.0,0.0,0.0,377601,Vetle Auklend,2025-05-28 04:50:34
13145,727696,4,45318264,76,Vetle Auklend (Viking FK) Substitution at 45',Vetle Auklend Substitution,2,2700,45',510,0,0,1980-01-01,0.0,0.0,0.0,0.0,0.0,0.0,276089,Jost Urbancic,2025-05-28 04:50:34
13145,727696,5,45318568,70,Edvin Austbø (Viking FK) Goal at 57',Edvin Austbø Goal,2,3420,57',510,0,0,1980-01-01,0.0,0.0,0.0,0.0,0.0,0.0,341309,Edvin Austbø,2025-05-28 04:50:34
13145,727696,6,45318631,76,Herman Haugen (Viking FK) Substitution at 60',Herman Haugen Substitution,2,3600,60',510,0,0,1980-01-01,0.0,0.0,0.0,0.0,0.0,0.0,303105,Herman Haugen,2025-05-28 04:50:34
13145,727696,7,45318632,76,Christian Cappis (Viking FK) Substitution at 60',Christian Cappis Substitution,2,3600,60',510,0,0,1980-01-01,0.0,0.0,0.0,0.0,0.0,0.0,283864,Christian Cappis,2025-05-28 04:50:34
13145,727696,6,45318631,76,Herman Haugen (Viking FK) Substitution at 60',Herman Haugen Substitution,2,3600,60',510,0,0,1980-01-01,0.0,0.0,0.0,0.0,0.0,0.0,272701,Anders Baertelsen,2025-05-28 04:50:34
13145,727696,7,45318632,76,Christian Cappis (Viking FK) Substitution at 60',Christian Cappis Substitution,2,3600,60',510,0,0,1980-01-01,0.0,0.0,0.0,0.0,0.0,0.0,380299,Jakob Segadal Hansen,2025-05-28 04:50:34
13145,727696,8,45318976,76,Viljar Vevatne (Viking FK) Substitution at 75',Viljar Vevatne Substitution,2,4500,75',510,0,0,1980-01-01,0.0,0.0,0.0,0.0,0.0,0.0,186071,Viljar Vevatne,2025-05-28 04:50:34
13145,727696,8,45318976,76,Viljar Vevatne (Viking FK) Substitution at 75',Viljar Vevatne Substitution,2,4500,75',510,0,0,1980-01-01,0.0,0.0,0.0,0.0,0.0,0.0,341309,Edvin Austbø,2025-05-28 04:50:34
13145,727696,9,45319161,76,Franklin Nyenetue (Kristiansund BK) Substitution at 84',Franklin Nyenetue Substitution,2,5040,84',6672,0,0,1980-01-01,0.0,0.0,0.0,0.0,0.0,0.0,304570,Franklin Nyenetue,2025-05-28 04:50:34
13145,727696,10,45319191,76,Niklas Odegard (Kristiansund BK) Substitution at 84',Niklas Odegard Substitution,2,5040,84',6672,0,0,1980-01-01,0.0,0.0,0.0,0.0,0.0,0.0,325047,Niklas Odegard,2025-05-28 04:50:34
13145,727696,11,45319192,76,Kristoffer Askildsen (Viking FK) Substitution at 84',Kristoffer Askildsen Substitutio,2,5040,84',510,0,0,1980-01-01,0.0,0.0,0.0,0.0,0.0,0.0,280963,Kristoffer Askildsen,2025-05-28 04:50:34
13145,727696,9,45319161,76,Franklin Nyenetue (Kristiansund BK) Substitution at 84',Franklin Nyenetue Substitution,2,5040,84',6672,0,0,1980-01-01,0.0,0.0,0.0,0.0,0.0,0.0,221168,Rezan Corlu,2025-05-28 04:50:34
13145,727696,10,45319191,76,Niklas Odegard (Kristiansund BK) Substitution at 84',Niklas Odegard Substitution,2,5040,84',6672,0,0,1980-01-01,0.0,0.0,0.0,0.0,0.0,0.0,361817,David Tufekcic,2025-05-28 04:50:34
13145,727696,11,45319192,76,Kristoffer Askildsen (Viking FK) Substitution at 84',Kristoffer Askildsen Substitutio,2,5040,84',510,0,0,1980-01-01,0.0,0.0,0.0,0.0,0.0,0.0,186248,Sander Svendsen,2025-05-28 04:50:34
13145,727697,1,45319563,94,Mads Sande (SK Brann) Yellow Card at 6',Mads Sande Yellow Card,1,360,6',620,0,0,1980-01-01,0.0,0.0,0.0,0.0,0.0,0.0,303280,Mads Sande,2025-05-28 04:50:34
13145,727697,2,45319654,94,Aune Heggebo (SK Brann) Yellow Card at 25',Aune Heggebo Yellow Card,1,1500,25',620,0,0,1980-01-01,0.0,0.0,0.0,0.0,0.0,0.0,272749,Aune Heggebo,2025-05-28 04:50:34
13145,727697,3,45319665,94,Troy Nyhammer (Haugesund) Yellow Card at 26',Troy Nyhammer Yellow Card,1,1560,26',3327,0,0,1980-01-01,0.0,0.0,0.0,0.0,0.0,0.0,354800,Troy Nyhammer,2025-05-28 04:50:34
13145,727697,4,45319725,76,Anders Bondhus (Haugesund) Substitution at 35',Anders Bondhus Substitution,1,2100,35',3327,0,0,1980-01-01,0.0,0.0,0.0,0.0,0.0,0.0,363197,Anders Bondhus,2025-05-28 04:50:34
13145,727697,4,45319725,76,Anders Bondhus (Haugesund) Substitution at 35',Anders Bondhus Substitution,1,2100,35',3327,0,0,1980-01-01,0.0,0.0,0.0,0.0,0.0,0.0,243517,Oscar Krusnell,2025-05-28 04:50:34
13145,727697,5,45319951,76,Mikkel Hope (Haugesund) Substitution at 55',Mikkel Hope Substitution,2,3300,55',3327,0,0,1980-01-01,0.0,0.0,0.0,0.0,0.0,0.0,359501,Mikkel Hope,2025-05-28 04:50:34
13145,727697,6,45319955,76,Ismael Camara (Haugesund) Substitution at 55',Ismael Camara Substitution,2,3300,55',3327,0,0,1980-01-01,0.0,0.0,0.0,0.0,0.0,0.0,400054,Ismael Camara,2025-05-28 04:50:34
13145,727697,7,45319956,76,Emil Schlichting (Haugesund) Substitution at 55',Emil Schlichting Substitution,2,3300,55',3327,0,0,1980-01-01,0.0,0.0,0.0,0.0,0.0,0.0,366229,Emil Schlichting,2025-05-28 04:50:34
13145,727697,5,45319951,76,Mikkel Hope (Haugesund) Substitution at 55',Mikkel Hope Substitution,2,3300,55',3327,0,0,1980-01-01,0.0,0.0,0.0,0.0,0.0,0.0,354800,Troy Nyhammer,2025-05-28 04:50:34
13145,727697,6,45319955,76,Ismael Camara (Haugesund) Substitution at 55',Ismael Camara Substitution,2,3300,55',3327,0,0,1980-01-01,0.0,0.0,0.0,0.0,0.0,0.0,325422,Vegard Solheim,2025-05-28 04:50:34
13145,727697,7,45319956,76,Emil Schlichting (Haugesund) Substitution at 55',Emil Schlichting Substitution,2,3300,55',3327,0,0,1980-01-01,0.0,0.0,0.0,0.0,0.0,0.0,338770,Sander Innvær,2025-05-28 04:50:34
13145,727697,8,45319961,70,Mads Sande (SK Brann) Goal at 60',Mads Sande Goal,2,3600,60',620,0,0,1980-01-01,0.0,0.0,0.0,0.0,0.0,0.0,303280,Mads Sande,2025-05-28 04:50:34
13145,727697,9,45319981,76,Denzel De Roeve (SK Brann) Substitution at 67',Denzel De Roeve Substitution,2,4020,67',620,0,0,1980-01-01,0.0,0.0,0.0,0.0,0.0,0.0,363067,Denzel De Roeve,2025-05-28 04:50:34
13145,727697,10,45319984,76,Mads Kristian Hansen (SK Brann) Substitution at 67',Mads Kristian Hansen Substitutio,2,4020,67',620,0,0,1980-01-01,0.0,0.0,0.0,0.0,0.0,0.0,298069,Mads Kristian Hansen,2025-05-28 04:50:34
13145,727697,9,45319981,76,Denzel De Roeve (SK Brann) Substitution at 67',Denzel De Roeve Substitution,2,4020,67',620,0,0,1980-01-01,0.0,0.0,0.0,0.0,0.0,0.0,285881,Thore Baardsen Pedersen,2025-05-28 04:50:34
13145,727697,10,45319984,76,Mads Kristian Hansen (SK Brann) Substitution at 67',Mads Kristian Hansen Substitutio,2,4020,67',620,0,0,1980-01-01,0.0,0.0,0.0,0.0,0.0,0.0,303280,Mads Sande,2025-05-28 04:50:34
13145,727697,11,45320017,76,Ulrick Mathisen (SK Brann) Substitution at 80',Ulrick Mathisen Substitution,2,4800,80',620,0,0,1980-01-01,0.0,0.0,0.0,0.0,0.0,0.0,274042,Ulrick Mathisen,2025-05-28 04:50:34
13145,727697,12,45320038,76,Rasmus Holten (SK Brann) Substitution at 80',Rasmus Holten Substitution,2,4800,80',620,0,0,1980-01-01,0.0,0.0,0.0,0.0,0.0,0.0,356399,Rasmus Holten,2025-05-28 04:50:34
13145,727697,11,45320017,76,Ulrick Mathisen (SK Brann) Substitution at 80',Ulrick Mathisen Substitution,2,4800,80',620,0,0,1980-01-01,0.0,0.0,0.0,0.0,0.0,0.0,173355,Bard Finne,2025-05-28 04:50:34
13145,727697,12,45320038,76,Rasmus Holten (SK Brann) Substitution at 80',Rasmus Holten Substitution,2,4800,80',620,0,0,1980-01-01,0.0,0.0,0.0,0.0,0.0,0.0,205582,Joachim Soltvedt,2025-05-28 04:50:34
13145,727697,13,45320070,76,Martin Samuelsen (Haugesund) Substitution at 84',Martin Samuelsen Substitution,2,5040,84',3327,0,0,1980-01-01,0.0,0.0,0.0,0.0,0.0,0.0,222531,Martin Samuelsen,2025-05-28 04:50:34
13145,727697,13,45320070,76,Martin Samuelsen (Haugesund) Substitution at 84',Martin Samuelsen Substitution,2,5040,84',3327,0,0,1980-01-01,0.0,0.0,0.0,0.0,0.0,0.0,358514,Mikkel Fischer,2025-05-28 04:50:34
13145,727697,14,45320157,70,Aune Heggebo (SK Brann) Goal at 89',Aune Heggebo Goal,2,5340,89',620,0,0,1980-01-01,0.0,0.0,0.0,0.0,0.0,0.0,272749,Aune Heggebo,2025-05-28 04:50:34
13145,727697,15,45320193,94,Madiodio Dia (Haugesund) Yellow Card at 91',Madiodio Dia Yellow Card,2,5400,90'+1',3327,0,0,1980-01-01,0.0,0.0,0.0,0.0,0.0,0.0,369506,Madiodio Dia,2025-05-28 04:50:34
13145,727698,1,45325536,94,Bjørn Martin Kristensen (KFUM Oslo) Yellow Card at 18',Bjørn Martin Kristensen Yellow C,1,1080,18',22165,0,0,1980-01-01,0.0,0.0,0.0,0.0,0.0,0.0,348319,Bjørn Martin Kristensen,2025-05-28 04:50:34
13145,727698,2,45325548,93,Simen Hestnes (KFUM Oslo) Red Card at 40',Simen Hestnes Red Card,1,2400,40',22165,0,0,1980-01-01,0.0,0.0,0.0,0.0,0.0,0.0,378941,Simen Hestnes,2025-05-28 04:50:34
13145,727698,3,45325560,76,Teodor Haltvik (KFUM Oslo) Substitution at 45',Teodor Haltvik Substitution,2,2700,45',22165,0,0,1980-01-01,0.0,0.0,0.0,0.0,0.0,0.0,277210,Teodor Haltvik,2025-05-28 04:50:34
13145,727698,3,45325560,76,Teodor Haltvik (KFUM Oslo) Substitution at 45',Teodor Haltvik Substitution,2,2700,45',22165,0,0,1980-01-01,0.0,0.0,0.0,0.0,0.0,0.0,348319,Bjørn Martin Kristensen,2025-05-28 04:50:34
13145,727698,4,45325567,94,Filip Thorvaldsen (Valerenga) Yellow Card at 54',Filip Thorvaldsen Yellow Card,2,3240,54',2791,0,0,1980-01-01,0.0,0.0,0.0,0.0,0.0,0.0,359797,Filip Thorvaldsen,2025-05-28 04:50:34
13145,727698,5,45325568,94,Håkon Hoseth (KFUM Oslo) Yellow Card at 54',Håkon Hoseth Yellow Card,2,3240,54',22165,0,0,1980-01-01,0.0,0.0,0.0,0.0,0.0,0.0,378938,Håkon Hoseth,2025-05-28 04:50:34
13145,727698,6,45325590,70,Filip Thorvaldsen (Valerenga) Goal at 64',Filip Thorvaldsen Goal,2,3840,64',2791,0,0,1980-01-01,0.0,0.0,0.0,0.0,0.0,0.0,359797,Filip Thorvaldsen,2025-05-28 04:50:34
13145,727698,7,45325611,94,Ayoub Aleesami (KFUM Oslo) Yellow Card at 72',Ayoub Aleesami Yellow Card,2,4320,72',22165,0,0,1980-01-01,0.0,0.0,0.0,0.0,0.0,0.0,378931,Ayoub Aleesami,2025-05-28 04:50:34
13145,727698,8,45325613,76,David Hickson (KFUM Oslo) Substitution at 73',David Hickson Substitution,2,4380,73',22165,0,0,1980-01-01,0.0,0.0,0.0,0.0,0.0,0.0,379952,David Hickson,2025-05-28 04:50:34
13145,727698,8,45325613,76,David Hickson (KFUM Oslo) Substitution at 73',David Hickson Substitution,2,4380,73',22165,0,0,1980-01-01,0.0,0.0,0.0,0.0,0.0,0.0,378940,Robin Rasch,2025-05-28 04:50:34
13145,727698,9,45325621,76,Noah Pallas (Valerenga) Substitution at 78',Noah Pallas Substitution,2,4680,78',2791,0,0,1980-01-01,0.0,0.0,0.0,0.0,0.0,0.0,356980,Noah Pallas,2025-05-28 04:50:34
13145,727698,9,45325621,76,Noah Pallas (Valerenga) Substitution at 78',Noah Pallas Substitution,2,4680,78',2791,0,0,1980-01-01,0.0,0.0,0.0,0.0,0.0,0.0,357210,Vinícius Nogueira,2025-05-28 04:50:34
13145,727698,10,45325627,76,Daniel Schneider (KFUM Oslo) Substitution at 79',Daniel Schneider Substitution,2,4740,79',22165,0,0,1980-01-01,0.0,0.0,0.0,0.0,0.0,0.0,402441,Daniel Schneider,2025-05-28 04:50:34
13145,727698,11,45325628,76,Amin Nouri (KFUM Oslo) Substitution at 79',Amin Nouri Substitution,2,4740,79',22165,0,0,1980-01-01,0.0,0.0,0.0,0.0,0.0,0.0,129211,Amin Nouri,2025-05-28 04:50:34
13145,727698,10,45325627,76,Daniel Schneider (KFUM Oslo) Substitution at 79',Daniel Schneider Substitution,2,4740,79',22165,0,0,1980-01-01,0.0,0.0,0.0,0.0,0.0,0.0,378946,Mathias Tønnessen,2025-05-28 04:50:34
13145,727698,11,45325628,76,Amin Nouri (KFUM Oslo) Substitution at 79',Amin Nouri Substitution,2,4740,79',22165,0,0,1980-01-01,0.0,0.0,0.0,0.0,0.0,0.0,378938,Håkon Hoseth,2025-05-28 04:50:34
13145,727698,12,45325636,76,Niclas Semmen (KFUM Oslo) Substitution at 83',Niclas Semmen Substitution,2,4980,83',22165,0,0,1980-01-01,0.0,0.0,0.0,0.0,0.0,0.0,382874,Niclas Semmen,2025-05-28 04:50:34
13145,727698,12,45325636,76,Niclas Semmen (KFUM Oslo) Substitution at 83',Niclas Semmen Substitution,2,4980,83',22165,0,0,1980-01-01,0.0,0.0,0.0,0.0,0.0,0.0,378936,Obilor Okeke,2025-05-28 04:50:34
13145,727698,13,45325641,76,Håkon Sjåtil (Valerenga) Substitution at 87',Håkon Sjåtil Substitution,2,5220,87',2791,0,0,1980-01-01,0.0,0.0,0.0,0.0,0.0,0.0,379439,Håkon Sjåtil,2025-05-28 04:50:34
13145,727698,13,45325641,76,Håkon Sjåtil (Valerenga) Substitution at 87',Håkon Sjåtil Substitution,2,5220,87',2791,0,0,1980-01-01,0.0,0.0,0.0,0.0,0.0,0.0,359797,Filip Thorvaldsen,2025-05-28 04:50:34
