seasonType,eventId,playOrder,playId,typeId,text,shortText,period,clockValue,clockDisplayValue,teamId,scoringPlay,shootout,wallclock,goalPositionX,goalPositionY,fieldpositionX,fieldPositionY,fieldPosition2X,fieldPosition2Y,athleteId,participant,updateDateTime
13145,727703,14,45338705,76,Yaw Paintsil (Tromso) Substitution at 77',Yaw Paintsil Substitution,2,4620,77',5270,0,0,1980-01-01,0.0,0.0,0.0,0.0,0.0,0.0,312960,Runar Norheim,2025-06-01 04:59:19
13145,727703,15,45338741,76,Anders Jenssen (Tromso) Substitution at 90',Anders Jenssen Substitution,2,5400,90',5270,0,0,1980-01-01,0.0,0.0,0.0,0.0,0.0,0.0,285915,Anders Jenssen,2025-06-01 04:59:19
13145,727703,16,45338744,76,Sigurd Jacobsen Prestmo (Tromso) Substitution at 90',Sigurd Jacobsen Prestmo Substitu,2,5400,90',5270,0,0,1980-01-01,0.0,0.0,0.0,0.0,0.0,0.0,399710,Sigurd Jacobsen Prestmo,2025-06-01 04:59:19
13145,727703,15,45338741,76,Anders Jenssen (Tromso) Substitution at 90',Anders Jenssen Substitution,2,5400,90',5270,0,0,1980-01-01,0.0,0.0,0.0,0.0,0.0,0.0,401339,Abubacarr Kinteh,2025-06-01 04:59:19
13145,727703,16,45338744,76,Sigurd Jacobsen Prestmo (Tromso) Substitution at 90',Sigurd Jacobsen Prestmo Substitu,2,5400,90',5270,0,0,1980-01-01,0.0,0.0,0.0,0.0,0.0,0.0,312875,David Edvardsson,2025-06-01 04:59:19
13145,727704,1,45343761,94,Rocco Robert Shein (Fredrikstad) Yellow Card at 21',Rocco Robert Shein Yellow Card,1,1260,21',3039,0,0,1980-01-01,0.0,0.0,0.0,0.0,0.0,0.0,307595,Rocco Robert Shein,2025-06-02 04:54:51
13145,727704,2,45343770,94,Oskar Øhlenschlæger (Fredrikstad) Yellow Card at 45',Oskar Øhlenschlæger Yellow Card,1,2700,45',3039,0,0,1980-01-01,0.0,0.0,0.0,0.0,0.0,0.0,399469,Oskar Øhlenschlæger,2025-06-02 04:54:51
13145,727704,3,45343802,76,Peter Reinhardsen (Sarpsborg FK) Substitution at 57',Peter Reinhardsen Substitution,2,3420,57',5002,0,0,1980-01-01,0.0,0.0,0.0,0.0,0.0,0.0,356987,Peter Reinhardsen,2025-06-02 04:54:51
13145,727704,3,45343802,76,Peter Reinhardsen (Sarpsborg FK) Substitution at 57',Peter Reinhardsen Substitution,2,3420,57',5002,0,0,1980-01-01,0.0,0.0,0.0,0.0,0.0,0.0,129292,Jo Inge Berget,2025-06-02 04:54:51
13145,727704,4,45343812,76,Sondre Sorlokk (Fredrikstad) Substitution at 69',Sondre Sorlokk Substitution,2,4140,69',3039,0,0,1980-01-01,0.0,0.0,0.0,0.0,0.0,0.0,268573,Sondre Sorlokk,2025-06-02 04:54:51
13145,727704,4,45343812,76,Sondre Sorlokk (Fredrikstad) Substitution at 69',Sondre Sorlokk Substitution,2,4140,69',3039,0,0,1980-01-01,0.0,0.0,0.0,0.0,0.0,0.0,319301,Henrik Skogvold,2025-06-02 04:54:51
13145,727704,5,45343822,94,Menno Koch (Sarpsborg FK) Yellow Card at 72',Menno Koch Yellow Card,2,4320,72',5002,0,0,1980-01-01,0.0,0.0,0.0,0.0,0.0,0.0,159247,Menno Koch,2025-06-02 04:54:51
13145,727704,6,45343823,76,Victor Halvorsen (Sarpsborg FK) Substitution at 73',Victor Halvorsen Substitution,2,4380,73',5002,0,0,1980-01-01,0.0,0.0,0.0,0.0,0.0,0.0,379133,Victor Halvorsen,2025-06-02 04:54:51
13145,727704,6,45343823,76,Victor Halvorsen (Sarpsborg FK) Substitution at 73',Victor Halvorsen Substitution,2,4380,73',5002,0,0,1980-01-01,0.0,0.0,0.0,0.0,0.0,0.0,238488,Mohanad Jeahze,2025-06-02 04:54:51
13145,727704,7,45343839,76,Patrick Metcalfe (Fredrikstad) Substitution at 78',Patrick Metcalfe Substitution,2,4680,78',3039,0,0,1980-01-01,0.0,0.0,0.0,0.0,0.0,0.0,255624,Patrick Metcalfe,2025-06-02 04:54:51
13145,727704,7,45343839,76,Patrick Metcalfe (Fredrikstad) Substitution at 78',Patrick Metcalfe Substitution,2,4680,78',3039,0,0,1980-01-01,0.0,0.0,0.0,0.0,0.0,0.0,307595,Rocco Robert Shein,2025-06-02 04:54:51
13145,727704,8,45343841,70,Sondre Sorlokk (Fredrikstad) Goal at 79',Sondre Sorlokk Goal,2,4740,79',3039,0,0,1980-01-01,0.0,0.0,0.0,0.0,0.0,0.0,268573,Sondre Sorlokk,2025-06-02 04:54:51
13145,727704,9,45343843,76,Benjamin Thoresen Faraas (Fredrikstad) Substitution at 87',Benjamin Thoresen Faraas Substit,2,5220,87',3039,0,0,1980-01-01,0.0,0.0,0.0,0.0,0.0,0.0,334075,Benjamin Thoresen Faraas,2025-06-02 04:54:51
13145,727704,10,45343848,76,Simen Rafn (Fredrikstad) Substitution at 87',Simen Rafn Substitution,2,5220,87',3039,0,0,1980-01-01,0.0,0.0,0.0,0.0,0.0,0.0,153894,Simen Rafn,2025-06-02 04:54:51
13145,727704,9,45343843,76,Benjamin Thoresen Faraas (Fredrikstad) Substitution at 87',Benjamin Thoresen Faraas Substit,2,5220,87',3039,0,0,1980-01-01,0.0,0.0,0.0,0.0,0.0,0.0,399469,Oskar Øhlenschlæger,2025-06-02 04:54:51
13145,727704,10,45343848,76,Simen Rafn (Fredrikstad) Substitution at 87',Simen Rafn Substitution,2,5220,87',3039,0,0,1980-01-01,0.0,0.0,0.0,0.0,0.0,0.0,312163,Daniel Eid,2025-06-02 04:54:51
13145,727704,11,45343856,76,Nikolai Skuseth (Sarpsborg FK) Substitution at 88',Nikolai Skuseth Substitution,2,5280,88',5002,0,0,1980-01-01,0.0,0.0,0.0,0.0,0.0,0.0,390697,Nikolai Skuseth,2025-06-02 04:54:51
13145,727704,12,45343857,76,Sveinn Aron Gudjohnsen (Sarpsborg FK) Substitution at 88',Sveinn Aron Gudjohnsen Substitut,2,5280,88',5002,0,0,1980-01-01,0.0,0.0,0.0,0.0,0.0,0.0,258016,Sveinn Aron Gudjohnsen,2025-06-02 04:54:51
13145,727704,13,45343858,76,Martin Håheim-Elveseter (Sarpsborg FK) Substitution at 88',Martin Håheim-Elveseter Substitu,2,5280,88',5002,0,0,1980-01-01,0.0,0.0,0.0,0.0,0.0,0.0,390698,Martin Håheim-Elveseter,2025-06-02 04:54:51
13145,727704,11,45343856,76,Nikolai Skuseth (Sarpsborg FK) Substitution at 88',Nikolai Skuseth Substitution,2,5280,88',5002,0,0,1980-01-01,0.0,0.0,0.0,0.0,0.0,0.0,387783,Alagie Sanyang,2025-06-02 04:54:51
13145,727704,12,45343857,76,Sveinn Aron Gudjohnsen (Sarpsborg FK) Substitution at 88',Sveinn Aron Gudjohnsen Substitut,2,5280,88',5002,0,0,1980-01-01,0.0,0.0,0.0,0.0,0.0,0.0,259194,Harald Nilsen Tangen,2025-06-02 04:54:51
13145,727704,13,45343858,76,Martin Håheim-Elveseter (Sarpsborg FK) Substitution at 88',Martin Håheim-Elveseter Substitu,2,5280,88',5002,0,0,1980-01-01,0.0,0.0,0.0,0.0,0.0,0.0,347328,Sander Christiansen,2025-06-02 04:54:51
13145,727704,14,45343888,70,Daniel Karlsbakk (Sarpsborg FK) Goal at 101',Daniel Karlsbakk Goal,2,5400,90'+11',5002,0,0,1980-01-01,0.0,0.0,0.0,0.0,0.0,0.0,334112,Daniel Karlsbakk,2025-06-02 04:54:51
13145,727704,15,45343891,94,Daniel Karlsbakk (Sarpsborg FK) Yellow Card at 101',Daniel Karlsbakk Yellow Card,2,5400,90'+11',5002,0,0,1980-01-01,0.0,0.0,0.0,0.0,0.0,0.0,334112,Daniel Karlsbakk,2025-06-02 04:54:51
13145,727704,16,45344016,94,Leonard Owusu (Fredrikstad) Yellow Card at 105',Leonard Owusu Yellow Card,2,5400,90'+15',3039,0,0,1980-01-01,0.0,0.0,0.0,0.0,0.0,0.0,301857,Leonard Owusu,2025-06-02 04:54:51
13145,727705,1,45344001,94,Luis Gorlich (Bryne) Yellow Card at 23',Luis Gorlich Yellow Card,1,1380,23',22530,0,0,1980-01-01,0.0,0.0,0.0,0.0,0.0,0.0,322556,Luis Gorlich,2025-06-03 04:51:43
13145,727705,2,45344005,70,Alfred Scriven (Bryne) Goal at 24',Alfred Scriven Goal,1,1440,24',22530,0,0,1980-01-01,0.0,0.0,0.0,0.0,0.0,0.0,287242,Alfred Scriven,2025-06-03 04:51:43
13145,727705,3,45344072,98,Sanel Bojadzic (Bryne) Penalty - Scored at 46',Sanel Bojadzic Penalty - Scored,1,2700,45'+1',22530,0,0,1980-01-01,0.0,0.0,0.0,0.0,0.0,0.0,400026,Sanel Bojadzic,2025-06-03 04:51:43
13145,727705,4,45344148,76,Loris Mettler (Sandefjord) Substitution at 63',Loris Mettler Substitution,2,3780,63',3279,0,0,1980-01-01,0.0,0.0,0.0,0.0,0.0,0.0,354454,Loris Mettler,2025-06-03 04:51:43
13145,727705,4,45344148,76,Loris Mettler (Sandefjord) Substitution at 63',Loris Mettler Substitution,2,3780,63',3279,0,0,1980-01-01,0.0,0.0,0.0,0.0,0.0,0.0,379168,Marcus Melchior,2025-06-03 04:51:43
13145,727705,5,45344156,70,Christopher Cheng (Sandefjord) Goal at 68',Christopher Cheng Goal,2,4080,68',3279,0,0,1980-01-01,0.0,0.0,0.0,0.0,0.0,0.0,303837,Christopher Cheng,2025-06-03 04:51:43
13145,727705,6,45344162,76,Mats Thornes (Bryne) Substitution at 69',Mats Thornes Substitution,2,4140,69',22530,0,0,1980-01-01,0.0,0.0,0.0,0.0,0.0,0.0,400025,Mats Thornes,2025-06-03 04:51:43
13145,727705,6,45344162,76,Mats Thornes (Bryne) Substitution at 69',Mats Thornes Substitution,2,4140,69',22530,0,0,1980-01-01,0.0,0.0,0.0,0.0,0.0,0.0,322556,Luis Gorlich,2025-06-03 04:51:43
13145,727705,7,45344169,70,Eirik Saunes (Bryne) Goal at 72',Eirik Saunes Goal,2,4320,72',22530,0,0,1980-01-01,0.0,0.0,0.0,0.0,0.0,0.0,400023,Eirik Saunes,2025-06-03 04:51:43
13145,727705,8,45344177,76,Bendik Berntsen (Sandefjord) Substitution at 75',Bendik Berntsen Substitution,2,4500,75',3279,0,0,1980-01-01,0.0,0.0,0.0,0.0,0.0,0.0,403711,Bendik Berntsen,2025-06-03 04:51:43
13145,727705,9,45344178,76,Robin Dzabic (Sandefjord) Substitution at 75',Robin Dzabic Substitution,2,4500,75',3279,0,0,1980-01-01,0.0,0.0,0.0,0.0,0.0,0.0,396525,Robin Dzabic,2025-06-03 04:51:43
13145,727705,8,45344177,76,Bendik Berntsen (Sandefjord) Substitution at 75',Bendik Berntsen Substitution,2,4500,75',3279,0,0,1980-01-01,0.0,0.0,0.0,0.0,0.0,0.0,281365,Sander Mork,2025-06-03 04:51:43
13145,727705,9,45344178,76,Robin Dzabic (Sandefjord) Substitution at 75',Robin Dzabic Substitution,2,4500,75',3279,0,0,1980-01-01,0.0,0.0,0.0,0.0,0.0,0.0,316022,Darrell Tibell,2025-06-03 04:51:43
13145,727705,10,45344197,76,Sjur Torgersen (Bryne) Substitution at 85',Sjur Torgersen Substitution,2,5100,85',22530,0,0,1980-01-01,0.0,0.0,0.0,0.0,0.0,0.0,398295,Sjur Torgersen,2025-06-03 04:51:43
13145,727705,10,45344197,76,Sjur Torgersen (Bryne) Substitution at 85',Sjur Torgersen Substitution,2,5100,85',22530,0,0,1980-01-01,0.0,0.0,0.0,0.0,0.0,0.0,400022,Duarte Moreira,2025-06-03 04:51:43
13145,727705,11,45344200,76,Vetle Egeli (Sandefjord) Substitution at 87',Vetle Egeli Substitution,2,5220,87',3279,0,0,1980-01-01,0.0,0.0,0.0,0.0,0.0,0.0,319331,Vetle Egeli,2025-06-03 04:51:43
13145,727705,11,45344200,76,Vetle Egeli (Sandefjord) Substitution at 87',Vetle Egeli Substitution,2,5220,87',3279,0,0,1980-01-01,0.0,0.0,0.0,0.0,0.0,0.0,277057,Evangelos Patoulidis,2025-06-03 04:51:43
13145,727705,12,45344206,76,Sondre Norheim (Bryne) Substitution at 91',Sondre Norheim Substitution,2,5400,90'+1',22530,0,0,1980-01-01,0.0,0.0,0.0,0.0,0.0,0.0,295734,Sondre Norheim,2025-06-03 04:51:43
13145,727705,13,45344211,70,Christopher Cheng (Sandefjord) Goal at 92',Christopher Cheng Goal,2,5400,90'+2',3279,0,0,1980-01-01,0.0,0.0,0.0,0.0,0.0,0.0,303837,Christopher Cheng,2025-06-03 04:51:43
13145,727705,14,45344214,94,Alfred Scriven (Bryne) Yellow Card at 96',Alfred Scriven Yellow Card,2,5400,90'+6',22530,0,0,1980-01-01,0.0,0.0,0.0,0.0,0.0,0.0,287242,Alfred Scriven,2025-06-03 04:51:43
13145,727705,12,45344206,76,Sondre Norheim (Bryne) Substitution at 91',Sondre Norheim Substitution,2,5400,90'+1',22530,0,0,1980-01-01,0.0,0.0,0.0,0.0,0.0,0.0,400026,Sanel Bojadzic,2025-06-03 04:51:43
13145,727706,1,45343968,76,Mikkel Konradsen Ceide (Rosenborg) Substitution at 18',Mikkel Konradsen Ceide Substitut,1,1080,18',438,0,0,1980-01-01,0.0,0.0,0.0,0.0,0.0,0.0,307723,Mikkel Konradsen Ceide,2025-06-02 04:54:51
13145,727706,1,45343968,76,Mikkel Konradsen Ceide (Rosenborg) Substitution at 18',Mikkel Konradsen Ceide Substitut,1,1080,18',438,0,0,1980-01-01,0.0,0.0,0.0,0.0,0.0,0.0,253048,Luca Racic,2025-06-02 04:54:51
13145,727706,2,45343980,94,Ayoub Aleesami (KFUM Oslo) Yellow Card at 22',Ayoub Aleesami Yellow Card,1,1320,22',22165,0,0,1980-01-01,0.0,0.0,0.0,0.0,0.0,0.0,378931,Ayoub Aleesami,2025-06-02 04:54:51
13145,727706,3,45344105,76,Emil Konradsen Ceide (Rosenborg) Substitution at 45',Emil Konradsen Ceide Substitutio,2,2700,45',438,0,0,1980-01-01,0.0,0.0,0.0,0.0,0.0,0.0,275113,Emil Konradsen Ceide,2025-06-02 04:54:51
13145,727706,3,45344105,76,Emil Konradsen Ceide (Rosenborg) Substitution at 45',Emil Konradsen Ceide Substitutio,2,2700,45',438,0,0,1980-01-01,0.0,0.0,0.0,0.0,0.0,0.0,312949,Ole Christian Saeter,2025-06-02 04:54:51
13145,727706,4,45344109,94,Mikkel Konradsen Ceide (Rosenborg) Yellow Card at 46',Mikkel Konradsen Ceide Yellow Ca,2,2760,46',438,0,0,1980-01-01,0.0,0.0,0.0,0.0,0.0,0.0,307723,Mikkel Konradsen Ceide,2025-06-02 04:54:51
13145,727706,5,45344149,94,Ulrik Jenssen (Rosenborg) Yellow Card at 68',Ulrik Jenssen Yellow Card,2,4080,68',438,0,0,1980-01-01,0.0,0.0,0.0,0.0,0.0,0.0,222439,Ulrik Jenssen,2025-06-02 04:54:51
13145,727706,6,45344154,76,Johannes Hummelvoll-Nuñez (KFUM Oslo) Substitution at 72',Johannes Hummelvoll-Nuñez Substi,2,4320,72',22165,0,0,1980-01-01,0.0,0.0,0.0,0.0,0.0,0.0,378932,Johannes Hummelvoll-Nuñez,2025-06-02 04:54:51
13145,727706,6,45344154,76,Johannes Hummelvoll-Nuñez (KFUM Oslo) Substitution at 72',Johannes Hummelvoll-Nuñez Substi,2,4320,72',22165,0,0,1980-01-01,0.0,0.0,0.0,0.0,0.0,0.0,379952,David Hickson,2025-06-02 04:54:51
13145,727706,7,45344157,98,Marius Sivertsen Broholm (Rosenborg) Penalty - Scored at 74',Marius Sivertsen Broholm Penalty,2,4440,74',438,0,0,1980-01-01,0.0,0.0,0.0,0.0,0.0,0.0,323173,Marius Sivertsen Broholm,2025-06-02 04:54:51
13145,727706,8,45344166,94,Sverre Sandal (KFUM Oslo) Yellow Card at 76',Sverre Sandal Yellow Card,2,4560,76',22165,0,0,1980-01-01,0.0,0.0,0.0,0.0,0.0,0.0,378942,Sverre Sandal,2025-06-02 04:54:51
13145,727706,9,45344167,76,Daniel Schneider (KFUM Oslo) Substitution at 76',Daniel Schneider Substitution,2,4560,76',22165,0,0,1980-01-01,0.0,0.0,0.0,0.0,0.0,0.0,402441,Daniel Schneider,2025-06-02 04:54:51
13145,727706,9,45344167,76,Daniel Schneider (KFUM Oslo) Substitution at 76',Daniel Schneider Substitution,2,4560,76',22165,0,0,1980-01-01,0.0,0.0,0.0,0.0,0.0,0.0,378931,Ayoub Aleesami,2025-06-02 04:54:51
13145,727706,10,45344170,76,Dino Islamovic (Rosenborg) Substitution at 78',Dino Islamovic Substitution,2,4680,78',438,0,0,1980-01-01,0.0,0.0,0.0,0.0,0.0,0.0,181637,Dino Islamovic,2025-06-02 04:54:51
13145,727706,10,45344170,76,Dino Islamovic (Rosenborg) Substitution at 78',Dino Islamovic Substitution,2,4680,78',438,0,0,1980-01-01,0.0,0.0,0.0,0.0,0.0,0.0,277007,Noah Jean Holm,2025-06-02 04:54:51
13145,727706,11,45344180,76,Teodor Haltvik (KFUM Oslo) Substitution at 82',Teodor Haltvik Substitution,2,4920,82',22165,0,0,1980-01-01,0.0,0.0,0.0,0.0,0.0,0.0,277210,Teodor Haltvik,2025-06-02 04:54:51
13145,727706,12,45344185,76,Mame Mor Ndiaye (KFUM Oslo) Substitution at 82',Mame Mor Ndiaye Substitution,2,4920,82',22165,0,0,1980-01-01,0.0,0.0,0.0,0.0,0.0,0.0,382873,Mame Mor Ndiaye,2025-06-02 04:54:51
13145,727706,11,45344180,76,Teodor Haltvik (KFUM Oslo) Substitution at 82',Teodor Haltvik Substitution,2,4920,82',22165,0,0,1980-01-01,0.0,0.0,0.0,0.0,0.0,0.0,348319,Bjørn Martin Kristensen,2025-06-02 04:54:51
13145,727706,12,45344185,76,Mame Mor Ndiaye (KFUM Oslo) Substitution at 82',Mame Mor Ndiaye Substitution,2,4920,82',22165,0,0,1980-01-01,0.0,0.0,0.0,0.0,0.0,0.0,378950,Jonas Hjorth,2025-06-02 04:54:51
13145,727706,13,45344186,70,Mame Mor Ndiaye (KFUM Oslo) Goal at 83',Mame Mor Ndiaye Goal,2,4980,83',22165,0,0,1980-01-01,0.0,0.0,0.0,0.0,0.0,0.0,382873,Mame Mor Ndiaye,2025-06-02 04:54:51
13145,727706,14,45344188,76,Isak Thorvaldsson (Rosenborg) Substitution at 86',Isak Thorvaldsson Substitution,2,5160,86',438,0,0,1980-01-01,0.0,0.0,0.0,0.0,0.0,0.0,295807,Isak Thorvaldsson,2025-06-02 04:54:51
13145,727706,15,45344189,76,Jonas Mortensen (Rosenborg) Substitution at 86',Jonas Mortensen Substitution,2,5160,86',438,0,0,1980-01-01,0.0,0.0,0.0,0.0,0.0,0.0,278152,Jonas Mortensen,2025-06-02 04:54:51
13145,727706,14,45344188,76,Isak Thorvaldsson (Rosenborg) Substitution at 86',Isak Thorvaldsson Substitution,2,5160,86',438,0,0,1980-01-01,0.0,0.0,0.0,0.0,0.0,0.0,238428,Moustafa Zeidan,2025-06-02 04:54:51
13145,727706,15,45344189,76,Jonas Mortensen (Rosenborg) Substitution at 86',Jonas Mortensen Substitution,2,5160,86',438,0,0,1980-01-01,0.0,0.0,0.0,0.0,0.0,0.0,225862,Erlend Dahl Reitan,2025-06-02 04:54:51
13145,727707,1,45343941,70,Ulrik Saltnes (Bodo/Glimt) Goal at 7',Ulrik Saltnes Goal,1,420,7',2980,0,0,1980-01-01,0.0,0.0,0.0,0.0,0.0,0.0,203670,Ulrik Saltnes,2025-06-03 04:51:43
13145,727707,2,45343957,94,Morten Konradsen (Haugesund) Yellow Card at 12',Morten Konradsen Yellow Card,1,720,12',3327,0,0,1980-01-01,0.0,0.0,0.0,0.0,0.0,0.0,202676,Morten Konradsen,2025-06-03 04:51:43
13145,727707,3,45343985,76,Anders Bondhus (Haugesund) Substitution at 24',Anders Bondhus Substitution,1,1440,24',3327,0,0,1980-01-01,0.0,0.0,0.0,0.0,0.0,0.0,363197,Anders Bondhus,2025-06-03 04:51:43
13145,727707,3,45343985,76,Anders Bondhus (Haugesund) Substitution at 24',Anders Bondhus Substitution,1,1440,24',3327,0,0,1980-01-01,0.0,0.0,0.0,0.0,0.0,0.0,303358,Parfait Bizoza,2025-06-03 04:51:43
13145,727707,4,45343994,94,Hakon Evjen (Bodo/Glimt) Yellow Card at 26',Hakon Evjen Yellow Card,1,1560,26',2980,0,0,1980-01-01,0.0,0.0,0.0,0.0,0.0,0.0,271088,Hakon Evjen,2025-06-03 04:51:43
13145,727707,5,45344026,76,Odin Bjortuft (Bodo/Glimt) Substitution at 37',Odin Bjortuft Substitution,1,2220,37',2980,0,0,1980-01-01,0.0,0.0,0.0,0.0,0.0,0.0,269732,Odin Bjortuft,2025-06-03 04:51:43
13145,727707,5,45344026,76,Odin Bjortuft (Bodo/Glimt) Substitution at 37',Odin Bjortuft Substitution,1,2220,37',2980,0,0,1980-01-01,0.0,0.0,0.0,0.0,0.0,0.0,238088,Fredrik Andre Bjørkan,2025-06-03 04:51:43
13145,727707,6,45344074,94,Mikkel Fischer (Haugesund) Yellow Card at 51',Mikkel Fischer Yellow Card,1,2700,45'+6',3327,0,0,1980-01-01,0.0,0.0,0.0,0.0,0.0,0.0,358514,Mikkel Fischer,2025-06-03 04:51:43
13145,727707,7,45344113,76,Sondre Auklend (Bodo/Glimt) Substitution at 45',Sondre Auklend Substitution,2,2700,45',2980,0,0,1980-01-01,0.0,0.0,0.0,0.0,0.0,0.0,303740,Sondre Auklend,2025-06-03 04:51:43
13145,727707,7,45344113,76,Sondre Auklend (Bodo/Glimt) Substitution at 45',Sondre Auklend Substitution,2,2700,45',2980,0,0,1980-01-01,0.0,0.0,0.0,0.0,0.0,0.0,271088,Hakon Evjen,2025-06-03 04:51:43
13145,727707,8,45344119,70,Jens Hauge (Bodo/Glimt) Goal at 50',Jens Hauge Goal,2,3000,50',2980,0,0,1980-01-01,0.0,0.0,0.0,0.0,0.0,0.0,235789,Jens Hauge,2025-06-03 04:51:43
13145,727707,9,45344127,76,Sondre Sörli (Bodo/Glimt) Substitution at 56',Sondre Sörli Substitution,2,3360,56',2980,0,0,1980-01-01,0.0,0.0,0.0,0.0,0.0,0.0,251612,Sondre Sörli,2025-06-03 04:51:43
13145,727707,9,45344127,76,Sondre Sörli (Bodo/Glimt) Substitution at 56',Sondre Sörli Substitution,2,3360,56',2980,0,0,1980-01-01,0.0,0.0,0.0,0.0,0.0,0.0,235789,Jens Hauge,2025-06-03 04:51:43
13145,727707,10,45344132,76,Isak Dybvik Määttä (Bodo/Glimt) Substitution at 57',Isak Dybvik Määttä Substitution,2,3420,57',2980,0,0,1980-01-01,0.0,0.0,0.0,0.0,0.0,0.0,302019,Isak Dybvik Määttä,2025-06-03 04:51:43
13145,727707,10,45344132,76,Isak Dybvik Määttä (Bodo/Glimt) Substitution at 57',Isak Dybvik Määttä Substitution,2,3420,57',2980,0,0,1980-01-01,0.0,0.0,0.0,0.0,0.0,0.0,176883,Haitam Aleesami,2025-06-03 04:51:43
13145,727707,11,45344144,76,Sander Innvær (Haugesund) Substitution at 64',Sander Innvær Substitution,2,3840,64',3327,0,0,1980-01-01,0.0,0.0,0.0,0.0,0.0,0.0,338770,Sander Innvær,2025-06-03 04:51:43
13145,727707,12,45344147,76,Amidou Traore (Haugesund) Substitution at 64',Amidou Traore Substitution,2,3840,64',3327,0,0,1980-01-01,0.0,0.0,0.0,0.0,0.0,0.0,380208,Amidou Traore,2025-06-03 04:51:43
13145,727707,11,45344144,76,Sander Innvær (Haugesund) Substitution at 64',Sander Innvær Substitution,2,3840,64',3327,0,0,1980-01-01,0.0,0.0,0.0,0.0,0.0,0.0,354800,Troy Nyhammer,2025-06-03 04:51:43
13145,727707,12,45344147,76,Amidou Traore (Haugesund) Substitution at 64',Amidou Traore Substitution,2,3840,64',3327,0,0,1980-01-01,0.0,0.0,0.0,0.0,0.0,0.0,202676,Morten Konradsen,2025-06-03 04:51:43
13145,727707,13,45344151,70,Ole Didrik Blomberg (Bodo/Glimt) Goal at 67',Ole Didrik Blomberg Goal,2,4020,67',2980,0,0,1980-01-01,0.0,0.0,0.0,0.0,0.0,0.0,307798,Ole Didrik Blomberg,2025-06-03 04:51:43
13145,727707,14,45344179,76,Martin Samuelsen (Haugesund) Substitution at 77',Martin Samuelsen Substitution,2,4620,77',3327,0,0,1980-01-01,0.0,0.0,0.0,0.0,0.0,0.0,222531,Martin Samuelsen,2025-06-03 04:51:43
13145,727707,14,45344179,76,Martin Samuelsen (Haugesund) Substitution at 77',Martin Samuelsen Substitution,2,4620,77',3327,0,0,1980-01-01,0.0,0.0,0.0,0.0,0.0,0.0,114205,Bruno Leite,2025-06-03 04:51:43
13145,727707,15,45344182,76,Ismael Camara (Haugesund) Substitution at 78',Ismael Camara Substitution,2,4680,78',3327,0,0,1980-01-01,0.0,0.0,0.0,0.0,0.0,0.0,400054,Ismael Camara,2025-06-03 04:51:43
13145,727707,16,45344183,76,Andreas Helmersen (Bodo/Glimt) Substitution at 78',Andreas Helmersen Substitution,2,4680,78',2980,0,0,1980-01-01,0.0,0.0,0.0,0.0,0.0,0.0,218561,Andreas Helmersen,2025-06-03 04:51:43
13145,727707,15,45344182,76,Ismael Camara (Haugesund) Substitution at 78',Ismael Camara Substitution,2,4680,78',3327,0,0,1980-01-01,0.0,0.0,0.0,0.0,0.0,0.0,366229,Emil Schlichting,2025-06-03 04:51:43
13145,727707,16,45344183,76,Andreas Helmersen (Bodo/Glimt) Substitution at 78',Andreas Helmersen Substitution,2,4680,78',2980,0,0,1980-01-01,0.0,0.0,0.0,0.0,0.0,0.0,272624,Kasper Waarst Høgh,2025-06-03 04:51:43
13145,727707,17,45344201,70,Andreas Helmersen (Bodo/Glimt) Goal at 86',Andreas Helmersen Goal,2,5160,86',2980,0,0,1980-01-01,0.0,0.0,0.0,0.0,0.0,0.0,218561,Andreas Helmersen,2025-06-03 04:51:43
13145,727708,1,45343933,70,Bard Finne (SK Brann) Goal at 4',Bard Finne Goal,1,240,4',620,0,0,1980-01-01,0.0,0.0,0.0,0.0,0.0,0.0,173355,Bard Finne,2025-06-02 04:54:51
13145,727708,2,45343962,70,Aune Heggebo (SK Brann) Goal at 14',Aune Heggebo Goal,1,840,14',620,0,0,1980-01-01,0.0,0.0,0.0,0.0,0.0,0.0,272749,Aune Heggebo,2025-06-02 04:54:51
13145,727708,3,45343977,98,Aune Heggebo (SK Brann) Penalty - Scored at 22',Aune Heggebo Penalty - Scored,1,1320,22',620,0,0,1980-01-01,0.0,0.0,0.0,0.0,0.0,0.0,272749,Aune Heggebo,2025-06-02 04:54:51
13145,727708,4,45344008,70,Ruben Alte (Kristiansund BK) Goal at 30',Ruben Alte Goal,1,1800,30',6672,0,0,1980-01-01,0.0,0.0,0.0,0.0,0.0,0.0,379954,Ruben Alte,2025-06-02 04:54:51
13145,727708,5,45344035,70,Mustapha Ubandoma (Kristiansund BK) Goal at 40',Mustapha Ubandoma Goal,1,2400,40',6672,0,0,1980-01-01,0.0,0.0,0.0,0.0,0.0,0.0,351346,Mustapha Ubandoma,2025-06-02 04:54:51
13145,727708,6,45344044,70,Bard Finne (SK Brann) Goal at 41',Bard Finne Goal,1,2460,41',620,0,0,1980-01-01,0.0,0.0,0.0,0.0,0.0,0.0,173355,Bard Finne,2025-06-02 04:54:51
13145,727708,7,45344112,76,Niklas Odegard (Kristiansund BK) Substitution at 45',Niklas Odegard Substitution,2,2700,45',6672,0,0,1980-01-01,0.0,0.0,0.0,0.0,0.0,0.0,325047,Niklas Odegard,2025-06-02 04:54:51
13145,727708,7,45344112,76,Niklas Odegard (Kristiansund BK) Substitution at 45',Niklas Odegard Substitution,2,2700,45',6672,0,0,1980-01-01,0.0,0.0,0.0,0.0,0.0,0.0,221168,Rezan Corlu,2025-06-02 04:54:51
13145,727708,8,45344115,94,Ruben Alte (Kristiansund BK) Yellow Card at 52',Ruben Alte Yellow Card,2,3120,52',6672,0,0,1980-01-01,0.0,0.0,0.0,0.0,0.0,0.0,379954,Ruben Alte,2025-06-02 04:54:51
13145,727708,9,45344130,76,Ulrick Mathisen (SK Brann) Substitution at 58',Ulrick Mathisen Substitution,2,3480,58',620,0,0,1980-01-01,0.0,0.0,0.0,0.0,0.0,0.0,274042,Ulrick Mathisen,2025-06-02 04:54:51
13145,727708,9,45344130,76,Ulrick Mathisen (SK Brann) Substitution at 58',Ulrick Mathisen Substitution,2,3480,58',620,0,0,1980-01-01,0.0,0.0,0.0,0.0,0.0,0.0,303280,Mads Sande,2025-06-02 04:54:51
13145,727708,10,45344131,76,Mads Kristian Hansen (SK Brann) Substitution at 59',Mads Kristian Hansen Substitutio,2,3540,59',620,0,0,1980-01-01,0.0,0.0,0.0,0.0,0.0,0.0,298069,Mads Kristian Hansen,2025-06-02 04:54:51
13145,727708,10,45344131,76,Mads Kristian Hansen (SK Brann) Substitution at 59',Mads Kristian Hansen Substitutio,2,3540,59',620,0,0,1980-01-01,0.0,0.0,0.0,0.0,0.0,0.0,173355,Bard Finne,2025-06-02 04:54:51
13145,727708,11,45344161,76,Franklin Nyenetue (Kristiansund BK) Substitution at 73',Franklin Nyenetue Substitution,2,4380,73',6672,0,0,1980-01-01,0.0,0.0,0.0,0.0,0.0,0.0,304570,Franklin Nyenetue,2025-06-02 04:54:51
13145,727708,11,45344161,76,Franklin Nyenetue (Kristiansund BK) Substitution at 73',Franklin Nyenetue Substitution,2,4380,73',6672,0,0,1980-01-01,0.0,0.0,0.0,0.0,0.0,0.0,361817,David Tufekcic,2025-06-02 04:54:51
13145,727708,12,45344165,76,Lars Remmem (SK Brann) Substitution at 75',Lars Remmem Substitution,2,4500,75',620,0,0,1980-01-01,0.0,0.0,0.0,0.0,0.0,0.0,383883,Lars Remmem,2025-06-02 04:54:51
13145,727708,13,45344168,76,Denzel De Roeve (SK Brann) Substitution at 75',Denzel De Roeve Substitution,2,4500,75',620,0,0,1980-01-01,0.0,0.0,0.0,0.0,0.0,0.0,363067,Denzel De Roeve,2025-06-02 04:54:51
13145,727708,12,45344165,76,Lars Remmem (SK Brann) Substitution at 75',Lars Remmem Substitution,2,4500,75',620,0,0,1980-01-01,0.0,0.0,0.0,0.0,0.0,0.0,321407,Eggert Aron Gudmundsson,2025-06-02 04:54:51
13145,727708,13,45344168,76,Denzel De Roeve (SK Brann) Substitution at 75',Denzel De Roeve Substitution,2,4500,75',620,0,0,1980-01-01,0.0,0.0,0.0,0.0,0.0,0.0,285881,Thore Baardsen Pedersen,2025-06-02 04:54:51
13145,727708,14,45344187,94,Lars Remmem (SK Brann) Yellow Card at 81',Lars Remmem Yellow Card,2,4860,81',620,0,0,1980-01-01,0.0,0.0,0.0,0.0,0.0,0.0,383883,Lars Remmem,2025-06-02 04:54:51
13145,727708,15,45344195,94,Emil Kornvig (SK Brann) Yellow Card at 88',Emil Kornvig Yellow Card,2,5280,88',620,0,0,1980-01-01,0.0,0.0,0.0,0.0,0.0,0.0,295848,Emil Kornvig,2025-06-02 04:54:51
13145,727708,16,45344196,76,Frederik Flex (Kristiansund BK) Substitution at 89',Frederik Flex Substitution,2,5340,89',6672,0,0,1980-01-01,0.0,0.0,0.0,0.0,0.0,0.0,399589,Frederik Flex,2025-06-02 04:54:51
13145,727708,16,45344196,76,Frederik Flex (Kristiansund BK) Substitution at 89',Frederik Flex Substitution,2,5340,89',6672,0,0,1980-01-01,0.0,0.0,0.0,0.0,0.0,0.0,335096,Mikkel Rakneberg,2025-06-02 04:54:51
13145,727708,17,45344198,76,Haakon Haugen (Kristiansund BK) Substitution at 90',Haakon Haugen Substitution,2,5400,90',6672,0,0,1980-01-01,0.0,0.0,0.0,0.0,0.0,0.0,377752,Haakon Haugen,2025-06-02 04:54:51
13145,727708,18,45344208,76,Rasmus Holten (SK Brann) Substitution at 94',Rasmus Holten Substitution,2,5400,90'+4',620,0,0,1980-01-01,0.0,0.0,0.0,0.0,0.0,0.0,356399,Rasmus Holten,2025-06-02 04:54:51
