seasonType,eventId,playOrder,playId,typeId,text,shortText,period,clockValue,clockDisplayValue,teamId,scoringPlay,shootout,wallclock,goalPositionX,goalPositionY,fieldpositionX,fieldPositionY,fieldPosition2X,fieldPosition2Y,athleteId,participant,updateDateTime
13231,731152,1,45307236,76,Brian Torrealba (Deportes Limache) Substitution at 20',Brian Torrealba Substitution,1,1200,20',19195,0,0,1980-01-01,0.0,0.0,0.0,0.0,0.0,0.0,207936.0,Brian Torrealba,2025-05-28 04:50:34
13231,731152,1,45307236,76,Brian Torrealba (Deportes Limache) Substitution at 20',Brian Torrealba Substitution,1,1200,20',19195,0,0,1980-01-01,0.0,0.0,0.0,0.0,0.0,0.0,270586.0,Jonathan Andia,2025-05-28 04:50:34
13231,731152,2,45307237,70,Brian Torrealba (Deportes Limache) Goal at 23',Brian Torrealba Goal,1,1380,23',19195,0,0,1980-01-01,0.0,0.0,0.0,0.0,0.0,0.0,207936.0,Brian Torrealba,2025-05-28 04:50:34
13231,731152,3,45307240,94,Agustin Arce (Universidad de Chile) Yellow Card at 33',Agustin Arce Yellow Card,1,1980,33',4139,0,0,1980-01-01,0.0,0.0,0.0,0.0,0.0,0.0,345276.0,Agustin Arce,2025-05-28 04:50:34
13231,731152,4,45307243,94,Antonio Díaz (Universidad de Chile) Yellow Card at 39',Antonio Díaz Yellow Card,1,2340,39',4139,0,0,1980-01-01,0.0,0.0,0.0,0.0,0.0,0.0,150385.0,Antonio Díaz,2025-05-28 04:50:34
13231,731152,5,45307256,76,Jose Ignacio Castro (Universidad de Chile) Substitution at 45',Jose Ignacio Castro Substitution,2,2700,45',4139,0,0,1980-01-01,0.0,0.0,0.0,0.0,0.0,0.0,315672.0,Jose Ignacio Castro,2025-05-28 04:50:34
13231,731152,5,45307256,76,Jose Ignacio Castro (Universidad de Chile) Substitution at 45',Jose Ignacio Castro Substitution,2,2700,45',4139,0,0,1980-01-01,0.0,0.0,0.0,0.0,0.0,0.0,150385.0,Antonio Díaz,2025-05-28 04:50:34
13231,731152,6,45307257,76,Leandro Miguel Fernandez (Universidad de Chile) Substitution at 57',Leandro Miguel Fernandez Substit,2,3420,57',4139,0,0,1980-01-01,0.0,0.0,0.0,0.0,0.0,0.0,40376.0,Leandro Miguel Fernandez,2025-05-28 04:50:34
13231,731152,7,45307258,76,Rodrigo Contreras (Universidad de Chile) Substitution at 57',Rodrigo Contreras Substitution,2,3420,57',4139,0,0,1980-01-01,0.0,0.0,0.0,0.0,0.0,0.0,180871.0,Rodrigo Contreras,2025-05-28 04:50:34
13231,731152,8,45307259,76,Israel Poblete (Universidad de Chile) Substitution at 57',Israel Poblete Substitution,2,3420,57',4139,0,0,1980-01-01,0.0,0.0,0.0,0.0,0.0,0.0,190392.0,Israel Poblete,2025-05-28 04:50:34
13231,731152,9,45307260,76,Charles Aránguiz (Universidad de Chile) Substitution at 57',Charles Aránguiz Substitution,2,3420,57',4139,0,0,1980-01-01,0.0,0.0,0.0,0.0,0.0,0.0,76778.0,Charles Aránguiz,2025-05-28 04:50:34
13231,731152,6,45307257,76,Leandro Miguel Fernandez (Universidad de Chile) Substitution at 57',Leandro Miguel Fernandez Substit,2,3420,57',4139,0,0,1980-01-01,0.0,0.0,0.0,0.0,0.0,0.0,379904.0,Flavio Moya,2025-05-28 04:50:34
13231,731152,7,45307258,76,Rodrigo Contreras (Universidad de Chile) Substitution at 57',Rodrigo Contreras Substitution,2,3420,57',4139,0,0,1980-01-01,0.0,0.0,0.0,0.0,0.0,0.0,281383.0,Julián Alfaro,2025-05-28 04:50:34
13231,731152,8,45307259,76,Israel Poblete (Universidad de Chile) Substitution at 57',Israel Poblete Substitution,2,3420,57',4139,0,0,1980-01-01,0.0,0.0,0.0,0.0,0.0,0.0,173570.0,Gonzalo Montes,2025-05-28 04:50:34
13231,731152,9,45307260,76,Charles Aránguiz (Universidad de Chile) Substitution at 57',Charles Aránguiz Substitution,2,3420,57',4139,0,0,1980-01-01,0.0,0.0,0.0,0.0,0.0,0.0,345276.0,Agustin Arce,2025-05-28 04:50:34
13231,731152,10,45307263,94,Leandro Miguel Fernandez (Universidad de Chile) Yellow Card at 70',Leandro Miguel Fernandez Yellow ,2,4200,70',4139,0,0,1980-01-01,0.0,0.0,0.0,0.0,0.0,0.0,40376.0,Leandro Miguel Fernandez,2025-05-28 04:50:34
13231,731152,11,45307264,94,Cesar Pinares (Deportes Limache) Yellow Card at 71',Cesar Pinares Yellow Card,2,4260,71',19195,0,0,1980-01-01,0.0,0.0,0.0,0.0,0.0,0.0,136984.0,Cesar Pinares,2025-05-28 04:50:34
13231,731152,12,45307282,76,Aldrix Jara (Deportes Limache) Substitution at 83',Aldrix Jara Substitution,2,4980,83',19195,0,0,1980-01-01,0.0,0.0,0.0,0.0,0.0,0.0,308842.0,Aldrix Jara,2025-05-29 04:48:06
13231,731152,13,45307284,76,Danilo Catalán (Deportes Limache) Substitution at 83',Danilo Catalán Substitution,2,4980,83',19195,0,0,1980-01-01,0.0,0.0,0.0,0.0,0.0,0.0,252606.0,Danilo Catalán,2025-05-28 04:50:34
13231,731152,12,45307282,76,Aldrix Jara (Deportes Limache) Substitution at 83',Aldrix Jara Substitution,2,4980,83',19195,0,0,1980-01-01,0.0,0.0,0.0,0.0,0.0,0.0,257627.0,Daniel Castro,2025-05-29 04:48:06
13231,731152,13,45307284,76,Danilo Catalán (Deportes Limache) Substitution at 83',Danilo Catalán Substitution,2,4980,83',19195,0,0,1980-01-01,0.0,0.0,0.0,0.0,0.0,0.0,136984.0,Cesar Pinares,2025-05-28 04:50:34
13231,731152,14,45307296,76,Mario Sandoval (Deportes Limache) Substitution at 88',Mario Sandoval Substitution,2,5280,88',19195,0,0,1980-01-01,0.0,0.0,0.0,0.0,0.0,0.0,222007.0,Mario Sandoval,2025-05-28 04:50:34
13231,731152,14,45307296,76,Mario Sandoval (Deportes Limache) Substitution at 88',Mario Sandoval Substitution,2,5280,88',19195,0,0,1980-01-01,0.0,0.0,0.0,0.0,0.0,0.0,250851.0,Misael Llantén,2025-05-28 04:50:34
13231,731152,15,45307308,70,Luis Guerra (Deportes Limache) Goal at 89',Luis Guerra Goal,2,5340,89',19195,0,0,1980-01-01,0.0,0.0,0.0,0.0,0.0,0.0,214867.0,Luis Guerra,2025-05-28 04:50:34
13231,731154,1,45319634,94,Gonzalo Sosa (Ñublense) Yellow Card at 24',Gonzalo Sosa Yellow Card,1,1440,24',7427,0,0,1980-01-01,0.0,0.0,0.0,0.0,0.0,0.0,166678.0,Gonzalo Sosa,2025-05-28 04:50:34
13231,731154,2,45319490,94,Giovanni Campusano (Ñublense) Yellow Card at 26',Giovanni Campusano Yellow Card,1,1560,26',7427,0,0,1980-01-01,0.0,0.0,0.0,0.0,0.0,0.0,170552.0,Giovanni Campusano,2025-05-28 04:50:34
13231,731154,3,45319537,76,Joaquín Montecinos (O'Higgins) Substitution at 43',Joaquín Montecinos Substitution,1,2580,43',6072,0,0,1980-01-01,0.0,0.0,0.0,0.0,0.0,0.0,207932.0,Joaquín Montecinos,2025-05-28 04:50:34
13231,731154,3,45319537,76,Joaquín Montecinos (O'Higgins) Substitution at 43',Joaquín Montecinos Substitution,1,2580,43',6072,0,0,1980-01-01,0.0,0.0,0.0,0.0,0.0,0.0,246715.0,Juan Ignacio Díaz,2025-05-28 04:50:34
13231,731154,4,45319701,70,Joaquín Montecinos (O'Higgins) Goal at 53',Joaquín Montecinos Goal,2,3180,53',6072,0,0,1980-01-01,0.0,0.0,0.0,0.0,0.0,0.0,207932.0,Joaquín Montecinos,2025-05-28 04:50:34
13231,731154,5,45319768,94,Carlos Alfredo Labrin Candia (Ñublense) Yellow Card at 62',Carlos Alfredo Labrin Candia Yel,2,3720,62',7427,0,0,1980-01-01,0.0,0.0,0.0,0.0,0.0,0.0,152856.0,Carlos Alfredo Labrin Candia,2025-05-28 04:50:34
13231,731154,6,45319792,76,Federico Mateos (Ñublense) Substitution at 64',Federico Mateos Substitution,2,3840,64',7427,0,0,1980-01-01,0.0,0.0,0.0,0.0,0.0,0.0,275073.0,Federico Mateos,2025-05-28 04:50:34
13231,731154,6,45319792,76,Federico Mateos (Ñublense) Substitution at 64',Federico Mateos Substitution,2,3840,64',7427,0,0,1980-01-01,0.0,0.0,0.0,0.0,0.0,0.0,396026.0,Daniel Saavedra,2025-05-28 04:50:34
13231,731154,7,45319802,76,Pedro Sánchez (Ñublense) Substitution at 65',Pedro Sánchez Substitution,2,3900,65',7427,0,0,1980-01-01,0.0,0.0,0.0,0.0,0.0,0.0,239060.0,Pedro Sánchez,2025-05-28 04:50:34
13231,731154,7,45319802,76,Pedro Sánchez (Ñublense) Substitution at 65',Pedro Sánchez Substitution,2,3900,65',7427,0,0,1980-01-01,0.0,0.0,0.0,0.0,0.0,0.0,103198.0,Patricio Rubio,2025-05-28 04:50:34
13231,731154,8,45319859,94,Osvaldo Bosso (Ñublense) Yellow Card at 72',Osvaldo Bosso Yellow Card,2,4320,72',7427,0,0,1980-01-01,0.0,0.0,0.0,0.0,0.0,0.0,168320.0,Osvaldo Bosso,2025-05-28 04:50:34
13231,731154,9,45319869,76,Ivan Rozas (Ñublense) Substitution at 74',Ivan Rozas Substitution,2,4440,74',7427,0,0,1980-01-01,0.0,0.0,0.0,0.0,0.0,0.0,248744.0,Ivan Rozas,2025-05-28 04:50:34
13231,731154,10,45319870,76,Arnaldo Castillo (O'Higgins) Substitution at 74',Arnaldo Castillo Substitution,2,4440,74',6072,0,0,1980-01-01,0.0,0.0,0.0,0.0,0.0,0.0,243162.0,Arnaldo Castillo,2025-05-28 04:50:34
13231,731154,9,45319869,76,Ivan Rozas (Ñublense) Substitution at 74',Ivan Rozas Substitution,2,4440,74',7427,0,0,1980-01-01,0.0,0.0,0.0,0.0,0.0,0.0,312417.0,Matías Plaza,2025-05-28 04:50:34
13231,731154,10,45319870,76,Arnaldo Castillo (O'Higgins) Substitution at 74',Arnaldo Castillo Substitution,2,4440,74',6072,0,0,1980-01-01,0.0,0.0,0.0,0.0,0.0,0.0,380524.0,Esteban Calderón,2025-05-28 04:50:34
13231,731154,11,45319903,76,Cristián Morales (O'Higgins) Substitution at 81',Cristián Morales Substitution,2,4860,81',6072,0,0,1980-01-01,0.0,0.0,0.0,0.0,0.0,0.0,116702.0,Cristián Morales,2025-05-28 04:50:34
13231,731154,12,45319914,76,Diego Sanhueza (Ñublense) Substitution at 81',Diego Sanhueza Substitution,2,4860,81',7427,0,0,1980-01-01,0.0,0.0,0.0,0.0,0.0,0.0,320556.0,Diego Sanhueza,2025-05-28 04:50:34
13231,731154,13,45319927,76,Lucas Molina (Ñublense) Substitution at 81',Lucas Molina Substitution,2,4860,81',7427,0,0,1980-01-01,0.0,0.0,0.0,0.0,0.0,0.0,34237.0,Lucas Molina,2025-05-28 04:50:34
13231,731154,11,45319903,76,Cristián Morales (O'Higgins) Substitution at 81',Cristián Morales Substitution,2,4860,81',6072,0,0,1980-01-01,0.0,0.0,0.0,0.0,0.0,0.0,157260.0,Rodrigo Godoy,2025-05-28 04:50:34
13231,731154,12,45319914,76,Diego Sanhueza (Ñublense) Substitution at 81',Diego Sanhueza Substitution,2,4860,81',7427,0,0,1980-01-01,0.0,0.0,0.0,0.0,0.0,0.0,195912.0,Rodrigo González,2025-05-28 04:50:34
13231,731154,13,45319927,76,Lucas Molina (Ñublense) Substitution at 81',Lucas Molina Substitution,2,4860,81',7427,0,0,1980-01-01,0.0,0.0,0.0,0.0,0.0,0.0,149819.0,Gabriel Graciani,2025-05-28 04:50:34
13231,731155,1,45326084,94,Marco Collao Ramos (Audax Italiano) Yellow Card at 2',Marco Collao Ramos Yellow Card,1,120,2',4138,0,0,1980-01-01,0.0,0.0,0.0,0.0,0.0,0.0,238838.0,Marco Collao Ramos,2025-05-29 04:48:06
13231,731155,2,45326118,70,Benjamin Gazzolo (Huachipato) Goal at 9',Benjamin Gazzolo Goal,1,540,9',4134,0,0,1980-01-01,0.0,0.0,0.0,0.0,0.0,0.0,204805.0,Benjamin Gazzolo,2025-05-29 04:48:06
13231,731155,3,45326132,94,Brayan Garrido (Huachipato) Yellow Card at 11',Brayan Garrido Yellow Card,1,660,11',4134,0,0,1980-01-01,0.0,0.0,0.0,0.0,0.0,0.0,272762.0,Brayan Garrido,2025-05-29 04:48:06
13231,731155,4,45326215,70,Germán Guiffrey (Audax Italiano) Goal at 30',Germán Guiffrey Goal,1,1800,30',4138,0,0,1980-01-01,0.0,0.0,0.0,0.0,0.0,0.0,276290.0,Germán Guiffrey,2025-05-29 04:48:06
13231,731155,5,45326220,94,Michael Fuentes (Audax Italiano) Yellow Card at 32',Michael Fuentes Yellow Card,1,1920,32',4138,0,0,1980-01-01,0.0,0.0,0.0,0.0,0.0,0.0,271216.0,Michael Fuentes,2025-05-29 04:48:06
13231,731155,6,45326242,94,Leonardo Valencia (Audax Italiano) Yellow Card at 36',Leonardo Valencia Yellow Card,1,2160,36',4138,0,0,1980-01-01,0.0,0.0,0.0,0.0,0.0,0.0,166747.0,Leonardo Valencia,2025-05-29 04:48:06
13231,731155,7,45326252,70,Lionel Altamirano (Huachipato) Goal at 39',Lionel Altamirano Goal,1,2340,39',4134,0,0,1980-01-01,0.0,0.0,0.0,0.0,0.0,0.0,176664.0,Lionel Altamirano,2025-05-29 04:48:06
13231,731155,8,45326545,98,Cris Martínez (Huachipato) Penalty - Scored at 54',Cris Martínez Penalty - Scored,2,3240,54',4134,0,0,1980-01-01,0.0,0.0,0.0,0.0,0.0,0.0,141081.0,Cris Martínez,2025-05-29 04:48:06
13231,731155,9,45326591,76,Paolo Guajardo (Audax Italiano) Substitution at 61',Paolo Guajardo Substitution,2,3660,61',4138,0,0,1980-01-01,0.0,0.0,0.0,0.0,0.0,0.0,317834.0,Paolo Guajardo,2025-05-29 04:48:06
13231,731155,10,45326598,76,Alexis González (Audax Italiano) Substitution at 61',Alexis González Substitution,2,3660,61',4138,0,0,1980-01-01,0.0,0.0,0.0,0.0,0.0,0.0,87673.0,Alexis González,2025-05-29 04:48:06
13231,731155,11,45326599,76,Martín Vicente Jiménez Salinas (Audax Italiano) Substitution at 61',Martín Vicente Jiménez Salinas S,2,3660,61',4138,0,0,1980-01-01,0.0,0.0,0.0,0.0,0.0,0.0,399824.0,Martín Vicente Jiménez Salinas,2025-05-29 04:48:06
13231,731155,9,45326591,76,Paolo Guajardo (Audax Italiano) Substitution at 61',Paolo Guajardo Substitution,2,3660,61',4138,0,0,1980-01-01,0.0,0.0,0.0,0.0,0.0,0.0,195639.0,Gastón Gil Romero,2025-05-29 04:48:06
13231,731155,10,45326598,76,Alexis González (Audax Italiano) Substitution at 61',Alexis González Substitution,2,3660,61',4138,0,0,1980-01-01,0.0,0.0,0.0,0.0,0.0,0.0,289082.0,Lautaro Palacios,2025-05-29 04:48:06
13231,731155,11,45326599,76,Martín Vicente Jiménez Salinas (Audax Italiano) Substitution at 61',Martín Vicente Jiménez Salinas S,2,3660,61',4138,0,0,1980-01-01,0.0,0.0,0.0,0.0,0.0,0.0,265882.0,Oliver Rojas,2025-05-29 04:48:06
13231,731155,12,45326602,70,Esteban Matus (Audax Italiano) Goal at 62',Esteban Matus Goal,2,3720,62',4138,0,0,1980-01-01,0.0,0.0,0.0,0.0,0.0,0.0,335211.0,Esteban Matus,2025-05-29 04:48:06
13231,731155,13,45326620,94,Rodrigo Odriozola (Huachipato) Yellow Card at 68',Rodrigo Odriozola Yellow Card,2,4080,68',4134,0,0,1980-01-01,0.0,0.0,0.0,0.0,0.0,0.0,131605.0,Rodrigo Odriozola,2025-05-29 04:48:06
13231,731155,14,45326624,94,Leandro Díaz (Huachipato) Yellow Card at 69',Leandro Díaz Yellow Card,2,4140,69',4134,0,0,1980-01-01,0.0,0.0,0.0,0.0,0.0,0.0,206959.0,Leandro Díaz,2025-05-29 04:48:06
13231,731155,15,45326626,76,Santiago Silva (Huachipato) Substitution at 73',Santiago Silva Substitution,2,4380,73',4134,0,0,1980-01-01,0.0,0.0,0.0,0.0,0.0,0.0,359980.0,Santiago Silva,2025-05-29 04:48:06
13231,731155,15,45326626,76,Santiago Silva (Huachipato) Substitution at 73',Santiago Silva Substitution,2,4380,73',4134,0,0,1980-01-01,0.0,0.0,0.0,0.0,0.0,0.0,250318.0,Carlos Villanueva,2025-05-29 04:48:06
13231,731155,16,45326637,76,Maicol León (Huachipato) Substitution at 80',Maicol León Substitution,2,4800,80',4134,0,0,1980-01-01,0.0,0.0,0.0,0.0,0.0,0.0,316256.0,Maicol León,2025-05-29 04:48:06
13231,731155,17,45326640,76,Vicente Conelli (Huachipato) Substitution at 80',Vicente Conelli Substitution,2,4800,80',4134,0,0,1980-01-01,0.0,0.0,0.0,0.0,0.0,0.0,313294.0,Vicente Conelli,2025-05-29 04:48:06
13231,731155,16,45326637,76,Maicol León (Huachipato) Substitution at 80',Maicol León Substitution,2,4800,80',4134,0,0,1980-01-01,0.0,0.0,0.0,0.0,0.0,0.0,96287.0,Juan Figueroa,2025-05-29 04:48:06
13231,731155,17,45326640,76,Vicente Conelli (Huachipato) Substitution at 80',Vicente Conelli Substitution,2,4800,80',4134,0,0,1980-01-01,0.0,0.0,0.0,0.0,0.0,0.0,141081.0,Cris Martínez,2025-05-29 04:48:06
13231,731155,18,45326641,93,Leandro Díaz (Huachipato) Red Card at 81',Leandro Díaz Red Card,2,4860,81',4134,0,0,1980-01-01,0.0,0.0,0.0,0.0,0.0,0.0,206959.0,Leandro Díaz,2025-05-29 04:48:06
13231,731155,19,45326644,94,Santiago Silva (Huachipato) Yellow Card at 83',Santiago Silva Yellow Card,2,4980,83',4134,0,0,1980-01-01,0.0,0.0,0.0,0.0,0.0,0.0,359980.0,Santiago Silva,2025-05-29 04:48:06
13231,731155,20,45326646,98,Leonardo Valencia (Audax Italiano) Penalty - Scored at 85',Leonardo Valencia Penalty - Scor,2,5100,85',4138,0,0,1980-01-01,0.0,0.0,0.0,0.0,0.0,0.0,166747.0,Leonardo Valencia,2025-05-29 04:48:06
13231,731155,21,45326663,76,Maximiliano Gutiérrez (Huachipato) Substitution at 91',Maximiliano Gutiérrez Substituti,2,5400,90'+1',4134,0,0,1980-01-01,0.0,0.0,0.0,0.0,0.0,0.0,208650.0,Maximiliano Gutiérrez,2025-05-29 04:48:06
13231,731155,22,45326670,76,Nicolás Aedo (Audax Italiano) Substitution at 91',Nicolás Aedo Substitution,2,5400,90'+1',4138,0,0,1980-01-01,0.0,0.0,0.0,0.0,0.0,0.0,308678.0,Nicolás Aedo,2025-05-29 04:48:06
13231,731155,23,45326671,76,Jimmy Martínez (Huachipato) Substitution at 91',Jimmy Martínez Substitution,2,5400,90'+1',4134,0,0,1980-01-01,0.0,0.0,0.0,0.0,0.0,0.0,211689.0,Jimmy Martínez,2025-05-29 04:48:06
13231,731155,24,45326675,98,Leonardo Valencia (Audax Italiano) Penalty - Scored at 94',Leonardo Valencia Penalty - Scor,2,5400,90'+4',4138,0,0,1980-01-01,0.0,0.0,0.0,0.0,0.0,0.0,166747.0,Leonardo Valencia,2025-05-29 04:48:06
13231,731155,25,45326679,76,Daniel Piña (Audax Italiano) Substitution at 96',Daniel Piña Substitution,2,5400,90'+6',4138,0,0,1980-01-01,0.0,0.0,0.0,0.0,0.0,0.0,335212.0,Daniel Piña,2025-05-29 04:48:06
13231,731155,21,45326663,76,Maximiliano Gutiérrez (Huachipato) Substitution at 91',Maximiliano Gutiérrez Substituti,2,5400,90'+1',4134,0,0,1980-01-01,0.0,0.0,0.0,0.0,0.0,0.0,176664.0,Lionel Altamirano,2025-05-29 04:48:06
13231,731155,22,45326670,76,Nicolás Aedo (Audax Italiano) Substitution at 91',Nicolás Aedo Substitution,2,5400,90'+1',4138,0,0,1980-01-01,0.0,0.0,0.0,0.0,0.0,0.0,271216.0,Michael Fuentes,2025-05-29 04:48:06
13231,731155,23,45326671,76,Jimmy Martínez (Huachipato) Substitution at 91',Jimmy Martínez Substitution,2,5400,90'+1',4134,0,0,1980-01-01,0.0,0.0,0.0,0.0,0.0,0.0,170425.0,Claudio Sepúlveda,2025-05-29 04:48:06
13231,731155,25,45326679,76,Daniel Piña (Audax Italiano) Substitution at 96',Daniel Piña Substitution,2,5400,90'+6',4138,0,0,1980-01-01,0.0,0.0,0.0,0.0,0.0,0.0,238838.0,Marco Collao Ramos,2025-05-29 04:48:06
13231,731156,1,45312192,97,Daniel Gutierrez (Colo Colo) Own Goal at 3',Daniel Gutierrez Own Goal,1,180,3',4132,0,0,1980-01-01,0.0,0.0,0.0,0.0,0.0,0.0,,Daniel Gutierrez,2025-05-29 04:48:06
13231,731156,2,45312245,70,Marcelo Correa (Colo Colo) Goal at 7',Marcelo Correa Goal,1,420,7',2688,0,0,1980-01-01,0.0,0.0,0.0,0.0,0.0,0.0,141825.0,Marcelo Correa,2025-05-29 04:48:06
13231,731156,3,45312432,70,Vicente Pizarro (Colo Colo) Goal at 21',Vicente Pizarro Goal,1,1260,21',2688,0,0,1980-01-01,0.0,0.0,0.0,0.0,0.0,0.0,289076.0,Vicente Pizarro,2025-05-29 04:48:06
13231,731156,4,45312457,94,Sebastián Pereira (Unión Española) Yellow Card at 24',Sebastián Pereira Yellow Card,1,1440,24',4132,0,0,1980-01-01,0.0,0.0,0.0,0.0,0.0,0.0,274484.0,Sebastián Pereira,2025-05-29 04:48:06
13231,731156,5,45312466,98,Arturo Vidal (Colo Colo) Penalty - Scored at 25',Arturo Vidal Penalty - Scored,1,1500,25',2688,0,0,1980-01-01,0.0,0.0,0.0,0.0,0.0,0.0,102198.0,Arturo Vidal,2025-05-29 04:48:06
13231,731156,6,45312616,94,Daniel Gutierrez (Colo Colo) Yellow Card at 39',Daniel Gutierrez Yellow Card,1,2340,39',2688,0,0,1980-01-01,0.0,0.0,0.0,0.0,0.0,0.0,297125.0,Daniel Gutierrez,2025-05-29 04:48:06
13231,731156,7,45312896,76,Cristian Zavala (Colo Colo) Substitution at 45',Cristian Zavala Substitution,2,2700,45',2688,0,0,1980-01-01,0.0,0.0,0.0,0.0,0.0,0.0,274529.0,Cristian Zavala,2025-05-29 04:48:06
13231,731156,8,45312901,76,Óscar Opazo (Colo Colo) Substitution at 45',Óscar Opazo Substitution,2,2700,45',2688,0,0,1980-01-01,0.0,0.0,0.0,0.0,0.0,0.0,144467.0,Óscar Opazo,2025-05-29 04:48:06
13231,731156,7,45312896,76,Cristian Zavala (Colo Colo) Substitution at 45',Cristian Zavala Substitution,2,2700,45',2688,0,0,1980-01-01,0.0,0.0,0.0,0.0,0.0,0.0,365149.0,Francisco Marchant,2025-05-29 04:48:06
13231,731156,8,45312901,76,Óscar Opazo (Colo Colo) Substitution at 45',Óscar Opazo Substitution,2,2700,45',2688,0,0,1980-01-01,0.0,0.0,0.0,0.0,0.0,0.0,297125.0,Daniel Gutierrez,2025-05-29 04:48:06
13231,731156,9,45313057,76,Fernando Ovelar (Unión Española) Substitution at 54',Fernando Ovelar Substitution,2,3240,54',4132,0,0,1980-01-01,0.0,0.0,0.0,0.0,0.0,0.0,283648.0,Fernando Ovelar,2025-05-29 04:48:06
13231,731156,10,45313058,76,Bruno Jáuregui (Unión Española) Substitution at 54',Bruno Jáuregui Substitution,2,3240,54',4132,0,0,1980-01-01,0.0,0.0,0.0,0.0,0.0,0.0,380478.0,Bruno Jáuregui,2025-05-29 04:48:06
13231,731156,9,45313057,76,Fernando Ovelar (Unión Española) Substitution at 54',Fernando Ovelar Substitution,2,3240,54',4132,0,0,1980-01-01,0.0,0.0,0.0,0.0,0.0,0.0,274106.0,Felipe Espinoza,2025-05-29 04:48:06
13231,731156,10,45313058,76,Bruno Jáuregui (Unión Española) Substitution at 54',Bruno Jáuregui Substitution,2,3240,54',4132,0,0,1980-01-01,0.0,0.0,0.0,0.0,0.0,0.0,357793.0,Leonardo Naranjo,2025-05-29 04:48:06
13231,731156,11,45313126,98,Claudio Aquino (Colo Colo) Penalty - Scored at 58',Claudio Aquino Penalty - Scored,2,3480,58',2688,0,0,1980-01-01,0.0,0.0,0.0,0.0,0.0,0.0,145020.0,Claudio Aquino,2025-05-29 04:48:06
13231,731156,12,45313218,76,Rodrigo Vásquez (Unión Española) Substitution at 66',Rodrigo Vásquez Substitution,2,3960,66',4132,0,0,1980-01-01,0.0,0.0,0.0,0.0,0.0,0.0,290916.0,Rodrigo Vásquez,2025-05-29 04:48:06
13231,731156,12,45313218,76,Rodrigo Vásquez (Unión Española) Substitution at 66',Rodrigo Vásquez Substitution,2,3960,66',4132,0,0,1980-01-01,0.0,0.0,0.0,0.0,0.0,0.0,213439.0,Ignacio Jeraldino,2025-05-29 04:48:06
13231,731156,13,45313239,76,Víctor Méndez (Colo Colo) Substitution at 67',Víctor Méndez Substitution,2,4020,67',2688,0,0,1980-01-01,0.0,0.0,0.0,0.0,0.0,0.0,252594.0,Víctor Méndez,2025-05-29 04:48:06
13231,731156,13,45313239,76,Víctor Méndez (Colo Colo) Substitution at 67',Víctor Méndez Substitution,2,4020,67',2688,0,0,1980-01-01,0.0,0.0,0.0,0.0,0.0,0.0,102198.0,Arturo Vidal,2025-05-29 04:48:06
13231,731156,14,45313277,94,Ariel Uribe (Unión Española) Yellow Card at 72',Ariel Uribe Yellow Card,2,4320,72',4132,0,0,1980-01-01,0.0,0.0,0.0,0.0,0.0,0.0,263309.0,Ariel Uribe,2025-05-29 04:48:06
13231,731156,15,45313355,76,Tomás Alarcón (Colo Colo) Substitution at 79',Tomás Alarcón Substitution,2,4740,79',2688,0,0,1980-01-01,0.0,0.0,0.0,0.0,0.0,0.0,238820.0,Tomás Alarcón,2025-05-29 04:48:06
13231,731156,15,45313355,76,Tomás Alarcón (Colo Colo) Substitution at 79',Tomás Alarcón Substitution,2,4740,79',2688,0,0,1980-01-01,0.0,0.0,0.0,0.0,0.0,0.0,141825.0,Marcelo Correa,2025-05-29 04:48:06
13231,731156,16,45313418,76,Salomón Rodríguez (Colo Colo) Substitution at 84',Salomón Rodríguez Substitution,2,5040,84',2688,0,0,1980-01-01,0.0,0.0,0.0,0.0,0.0,0.0,317955.0,Salomón Rodríguez,2025-05-29 04:48:06
13231,731156,16,45313418,76,Salomón Rodríguez (Colo Colo) Substitution at 84',Salomón Rodríguez Substitution,2,5040,84',2688,0,0,1980-01-01,0.0,0.0,0.0,0.0,0.0,0.0,145020.0,Claudio Aquino,2025-05-29 04:48:06
13231,731156,17,45313441,94,Víctor Méndez (Colo Colo) Yellow Card at 88',Víctor Méndez Yellow Card,2,5280,88',2688,0,0,1980-01-01,0.0,0.0,0.0,0.0,0.0,0.0,252594.0,Víctor Méndez,2025-05-29 04:48:06
13231,731156,18,45313442,76,Bryan Carvallo (Unión Española) Substitution at 88',Bryan Carvallo Substitution,2,5280,88',4132,0,0,1980-01-01,0.0,0.0,0.0,0.0,0.0,0.0,201143.0,Bryan Carvallo,2025-05-29 04:48:06
13231,731156,18,45313442,76,Bryan Carvallo (Unión Española) Substitution at 88',Bryan Carvallo Substitution,2,5280,88',4132,0,0,1980-01-01,0.0,0.0,0.0,0.0,0.0,0.0,263309.0,Ariel Uribe,2025-05-29 04:48:06
13231,731157,1,45314173,94,Ariel Martinez (Palestino) Yellow Card at 24',Ariel Martinez Yellow Card,1,1440,24',4422,0,0,1980-01-01,0.0,0.0,0.0,0.0,0.0,0.0,120602.0,Ariel Martinez,2025-05-28 04:50:34
13231,731157,2,45314285,94,Joe Abrigo (Palestino) Yellow Card at 39',Joe Abrigo Yellow Card,1,2340,39',4422,0,0,1980-01-01,0.0,0.0,0.0,0.0,0.0,0.0,208757.0,Joe Abrigo,2025-05-28 04:50:34
13231,731157,3,45314325,94,Alejandro Camargo (Coquimbo Unido) Yellow Card at 41',Alejandro Camargo Yellow Card,1,2460,41',8186,0,0,1980-01-01,0.0,0.0,0.0,0.0,0.0,0.0,206083.0,Alejandro Camargo,2025-05-28 04:50:34
13231,731157,4,45314744,76,Jason León (Palestino) Substitution at 45',Jason León Substitution,2,2700,45',4422,0,0,1980-01-01,0.0,0.0,0.0,0.0,0.0,0.0,148357.0,Jason León,2025-05-28 04:50:34
13231,731157,4,45314744,76,Jason León (Palestino) Substitution at 45',Jason León Substitution,2,2700,45',4422,0,0,1980-01-01,0.0,0.0,0.0,0.0,0.0,0.0,380433.0,Ian Gargues,2025-05-28 04:50:34
13231,731157,5,45314933,94,Sebastián Galani (Coquimbo Unido) Yellow Card at 53',Sebastián Galani Yellow Card,2,3180,53',8186,0,0,1980-01-01,0.0,0.0,0.0,0.0,0.0,0.0,205411.0,Sebastián Galani,2025-05-28 04:50:34
13231,731157,6,45315148,94,Diego Sánchez (Coquimbo Unido) Yellow Card at 64',Diego Sánchez Yellow Card,2,3840,64',8186,0,0,1980-01-01,0.0,0.0,0.0,0.0,0.0,0.0,199796.0,Diego Sánchez,2025-05-28 04:50:34
13231,731157,7,45315171,76,Enzo Riquelme (Coquimbo Unido) Substitution at 67',Enzo Riquelme Substitution,2,4020,67',8186,0,0,1980-01-01,0.0,0.0,0.0,0.0,0.0,0.0,386015.0,Enzo Riquelme,2025-05-28 04:50:34
13231,731157,7,45315171,76,Enzo Riquelme (Coquimbo Unido) Substitution at 67',Enzo Riquelme Substitution,2,4020,67',8186,0,0,1980-01-01,0.0,0.0,0.0,0.0,0.0,0.0,321055.0,Alejandro Azócar,2025-05-28 04:50:34
13231,731157,8,45315252,76,Gonzalo Tapia (Palestino) Substitution at 72',Gonzalo Tapia Substitution,2,4320,72',4422,0,0,1980-01-01,0.0,0.0,0.0,0.0,0.0,0.0,297128.0,Gonzalo Tapia,2025-05-28 04:50:34
13231,731157,9,45315253,76,Facundo Castro (Palestino) Substitution at 72',Facundo Castro Substitution,2,4320,72',4422,0,0,1980-01-01,0.0,0.0,0.0,0.0,0.0,0.0,202487.0,Facundo Castro,2025-05-28 04:50:34
13231,731157,8,45315252,76,Gonzalo Tapia (Palestino) Substitution at 72',Gonzalo Tapia Substitution,2,4320,72',4422,0,0,1980-01-01,0.0,0.0,0.0,0.0,0.0,0.0,134247.0,Jonathan Benítez,2025-05-28 04:50:34
13231,731157,9,45315253,76,Facundo Castro (Palestino) Substitution at 72',Facundo Castro Substitution,2,4320,72',4422,0,0,1980-01-01,0.0,0.0,0.0,0.0,0.0,0.0,169730.0,Bryan Carrasco,2025-05-28 04:50:34
13231,731157,10,45315330,76,Nicolas Johansen (Coquimbo Unido) Substitution at 77',Nicolas Johansen Substitution,2,4620,77',8186,0,0,1980-01-01,0.0,0.0,0.0,0.0,0.0,0.0,379438.0,Nicolas Johansen,2025-05-28 04:50:34
13231,731157,10,45315330,76,Nicolas Johansen (Coquimbo Unido) Substitution at 77',Nicolas Johansen Substitution,2,4620,77',8186,0,0,1980-01-01,0.0,0.0,0.0,0.0,0.0,0.0,320998.0,Benjamín Chandía,2025-05-28 04:50:34
13231,731157,11,45315354,76,Junior Marabel (Palestino) Substitution at 80',Junior Marabel Substitution,2,4800,80',4422,0,0,1980-01-01,0.0,0.0,0.0,0.0,0.0,0.0,253308.0,Junior Marabel,2025-05-28 04:50:34
13231,731157,11,45315354,76,Junior Marabel (Palestino) Substitution at 80',Junior Marabel Substitution,2,4800,80',4422,0,0,1980-01-01,0.0,0.0,0.0,0.0,0.0,0.0,208757.0,Joe Abrigo,2025-05-28 04:50:34
