seasonType,eventId,playOrder,playId,typeId,text,shortText,period,clockValue,clockDisplayValue,teamId,scoringPlay,shootout,wallclock,goalPositionX,goalPositionY,fieldpositionX,fieldPositionY,fieldPosition2X,fieldPosition2Y,athleteId,participant,updateDateTime
13145,727698,14,45325646,94,Aaron Olsen (Valerenga) Yellow Card at 88',Aaron Olsen Yellow Card,2,5280,88',2791,0,0,1980-01-01,0.0,0.0,0.0,0.0,0.0,0.0,357348,Aaron Olsen,2025-05-28 04:50:34
13145,727698,15,45325649,76,Mees Rijks (Valerenga) Substitution at 92',Mees Rijks Substitution,2,5400,90'+2',2791,0,0,1980-01-01,0.0,0.0,0.0,0.0,0.0,0.0,312358,Mees Rijks,2025-05-28 04:50:34
13145,727698,16,45325655,76,Stian Thorstensen (Valerenga) Substitution at 92',Stian Thorstensen Substitution,2,5400,90'+2',2791,0,0,1980-01-01,0.0,0.0,0.0,0.0,0.0,0.0,358083,Stian Thorstensen,2025-05-28 04:50:34
13145,727698,15,45325649,76,Mees Rijks (Valerenga) Substitution at 92',Mees Rijks Substitution,2,5400,90'+2',2791,0,0,1980-01-01,0.0,0.0,0.0,0.0,0.0,0.0,309265,Muamer Brajanac,2025-05-28 04:50:34
13145,727698,16,45325655,76,Stian Thorstensen (Valerenga) Substitution at 92',Stian Thorstensen Substitution,2,5400,90'+2',2791,0,0,1980-01-01,0.0,0.0,0.0,0.0,0.0,0.0,290110,Elias Hagen,2025-05-28 04:50:34
13145,727699,1,45329062,70,Ole Christian Saeter (Rosenborg) Goal at 24',Ole Christian Saeter Goal,1,1440,24',438,0,0,1980-01-01,0.0,0.0,0.0,0.0,0.0,0.0,312949,Ole Christian Saeter,2025-05-29 04:48:06
13145,727699,2,45329065,76,Rocco Robert Shein (Fredrikstad) Substitution at 57',Rocco Robert Shein Substitution,2,3420,57',3039,0,0,1980-01-01,0.0,0.0,0.0,0.0,0.0,0.0,307595,Rocco Robert Shein,2025-05-29 04:48:06
13145,727699,2,45329065,76,Rocco Robert Shein (Fredrikstad) Substitution at 57',Rocco Robert Shein Substitution,2,3420,57',3039,0,0,1980-01-01,0.0,0.0,0.0,0.0,0.0,0.0,255624,Patrick Metcalfe,2025-05-29 04:48:06
13145,727699,3,45329079,76,Isak Thorvaldsson (Rosenborg) Substitution at 62',Isak Thorvaldsson Substitution,2,3720,62',438,0,0,1980-01-01,0.0,0.0,0.0,0.0,0.0,0.0,295807,Isak Thorvaldsson,2025-05-29 04:48:06
13145,727699,3,45329079,76,Isak Thorvaldsson (Rosenborg) Substitution at 62',Isak Thorvaldsson Substitution,2,3720,62',438,0,0,1980-01-01,0.0,0.0,0.0,0.0,0.0,0.0,312949,Ole Christian Saeter,2025-05-29 04:48:06
13145,727699,4,45329080,76,Oskar Øhlenschlæger (Fredrikstad) Substitution at 66',Oskar Øhlenschlæger Substitution,2,3960,66',3039,0,0,1980-01-01,0.0,0.0,0.0,0.0,0.0,0.0,399469,Oskar Øhlenschlæger,2025-05-29 04:48:06
13145,727699,4,45329080,76,Oskar Øhlenschlæger (Fredrikstad) Substitution at 66',Oskar Øhlenschlæger Substitution,2,3960,66',3039,0,0,1980-01-01,0.0,0.0,0.0,0.0,0.0,0.0,268573,Sondre Sorlokk,2025-05-29 04:48:06
13145,727699,5,45329081,76,Dino Islamovic (Rosenborg) Substitution at 70',Dino Islamovic Substitution,2,4200,70',438,0,0,1980-01-01,0.0,0.0,0.0,0.0,0.0,0.0,181637,Dino Islamovic,2025-06-02 04:54:51
13145,727699,5,45329081,76,Dino Islamovic (Rosenborg) Substitution at 70',Dino Islamovic Substitution,2,4200,70',438,0,0,1980-01-01,0.0,0.0,0.0,0.0,0.0,0.0,277007,Noah Jean Holm,2025-06-02 04:54:51
13145,727699,6,45329105,76,Benjamin Thoresen Faraas (Fredrikstad) Substitution at 81',Benjamin Thoresen Faraas Substit,2,4860,81',3039,0,0,1980-01-01,0.0,0.0,0.0,0.0,0.0,0.0,334075,Benjamin Thoresen Faraas,2025-05-29 04:48:06
13145,727699,7,45329106,76,Ludvig Begby (Fredrikstad) Substitution at 81',Ludvig Begby Substitution,2,4860,81',3039,0,0,1980-01-01,0.0,0.0,0.0,0.0,0.0,0.0,378929,Ludvig Begby,2025-05-29 04:48:06
13145,727699,6,45329105,76,Benjamin Thoresen Faraas (Fredrikstad) Substitution at 81',Benjamin Thoresen Faraas Substit,2,4860,81',3039,0,0,1980-01-01,0.0,0.0,0.0,0.0,0.0,0.0,290031,Maxwell Woledzi,2025-05-29 04:48:06
13145,727699,7,45329106,76,Ludvig Begby (Fredrikstad) Substitution at 81',Ludvig Begby Substitution,2,4860,81',3039,0,0,1980-01-01,0.0,0.0,0.0,0.0,0.0,0.0,378948,Stian Molde,2025-05-29 04:48:06
13145,727699,8,45329108,94,Isak Thorvaldsson (Rosenborg) Yellow Card at 85',Isak Thorvaldsson Yellow Card,2,5100,85',438,0,0,1980-01-01,0.0,0.0,0.0,0.0,0.0,0.0,295807,Isak Thorvaldsson,2025-05-29 04:48:06
13145,727699,9,45329109,70,Marius Sivertsen Broholm (Rosenborg) Goal at 93',Marius Sivertsen Broholm Goal,2,5400,90'+3',438,0,0,1980-01-01,0.0,0.0,0.0,0.0,0.0,0.0,323173,Marius Sivertsen Broholm,2025-05-29 04:48:06
13145,727699,10,45329112,94,Ole Selnaes (Rosenborg) Yellow Card at 95',Ole Selnaes Yellow Card,2,5400,90'+5',438,0,0,1980-01-01,0.0,0.0,0.0,0.0,0.0,0.0,205636,Ole Selnaes,2025-05-29 04:48:06
13145,727700,1,45329173,94,Henrik Heggheim (Viking FK) Yellow Card at 24',Henrik Heggheim Yellow Card,1,1440,24',510,0,0,1980-01-01,0.0,0.0,0.0,0.0,0.0,0.0,303977,Henrik Heggheim,2025-05-29 04:48:06
13145,727700,2,45329174,70,Kasper Waarst Høgh (Bodo/Glimt) Goal at 25',Kasper Waarst Høgh Goal,1,1500,25',2980,0,0,1980-01-01,0.0,0.0,0.0,0.0,0.0,0.0,272624,Kasper Waarst Høgh,2025-05-29 04:48:06
13145,727700,3,45329178,70,Edvin Austbø (Viking FK) Goal at 28',Edvin Austbø Goal,1,1680,28',510,0,0,1980-01-01,0.0,0.0,0.0,0.0,0.0,0.0,341309,Edvin Austbø,2025-05-29 04:48:06
13145,727700,4,45329205,70,Jostein Gundersen (Bodo/Glimt) Goal at 44',Jostein Gundersen Goal,1,2640,44',2980,0,0,1980-01-01,0.0,0.0,0.0,0.0,0.0,0.0,218466,Jostein Gundersen,2025-05-29 04:48:06
13145,727700,5,45329242,76,Christian Cappis (Viking FK) Substitution at 56',Christian Cappis Substitution,2,3360,56',510,0,0,1980-01-01,0.0,0.0,0.0,0.0,0.0,0.0,283864,Christian Cappis,2025-06-03 04:51:43
13145,727700,5,45329242,76,Christian Cappis (Viking FK) Substitution at 56',Christian Cappis Substitution,2,3360,56',510,0,0,1980-01-01,0.0,0.0,0.0,0.0,0.0,0.0,186248,Sander Svendsen,2025-06-03 04:51:43
13145,727700,6,45329243,76,Zlatko Tripic (Viking FK) Substitution at 57',Zlatko Tripic Substitution,2,3420,57',510,0,0,1980-01-01,0.0,0.0,0.0,0.0,0.0,0.0,164279,Zlatko Tripic,2025-05-29 04:48:06
13145,727700,6,45329243,76,Zlatko Tripic (Viking FK) Substitution at 57',Zlatko Tripic Substitution,2,3420,57',510,0,0,1980-01-01,0.0,0.0,0.0,0.0,0.0,0.0,272701,Anders Baertelsen,2025-05-29 04:48:06
13145,727700,7,45329258,93,Jostein Gundersen (Bodo/Glimt) Red Card at 63',Jostein Gundersen Red Card,2,3780,63',2980,0,0,1980-01-01,0.0,0.0,0.0,0.0,0.0,0.0,218466,Jostein Gundersen,2025-05-29 04:48:06
13145,727700,8,45329275,94,Herman Haugen (Viking FK) Yellow Card at 69',Herman Haugen Yellow Card,2,4140,69',510,0,0,1980-01-01,0.0,0.0,0.0,0.0,0.0,0.0,303105,Herman Haugen,2025-05-29 04:48:06
13145,727700,9,45329281,76,Odin Bjortuft (Bodo/Glimt) Substitution at 70',Odin Bjortuft Substitution,2,4200,70',2980,0,0,1980-01-01,0.0,0.0,0.0,0.0,0.0,0.0,269732,Odin Bjortuft,2025-05-29 04:48:06
13145,727700,9,45329281,76,Odin Bjortuft (Bodo/Glimt) Substitution at 70',Odin Bjortuft Substitution,2,4200,70',2980,0,0,1980-01-01,0.0,0.0,0.0,0.0,0.0,0.0,272624,Kasper Waarst Høgh,2025-05-29 04:48:06
13145,727700,10,45329290,70,Zlatko Tripic (Viking FK) Goal at 73',Zlatko Tripic Goal,2,4380,73',510,0,0,1980-01-01,0.0,0.0,0.0,0.0,0.0,0.0,164279,Zlatko Tripic,2025-05-29 04:48:06
13145,727700,11,45329296,76,Simen Kvia-Egeskog (Viking FK) Substitution at 73',Simen Kvia-Egeskog Substitution,2,4380,73',510,0,0,1980-01-01,0.0,0.0,0.0,0.0,0.0,0.0,320678,Simen Kvia-Egeskog,2025-05-29 04:48:06
13145,727700,12,45329297,76,Kristoffer Askildsen (Viking FK) Substitution at 73',Kristoffer Askildsen Substitutio,2,4380,73',510,0,0,1980-01-01,0.0,0.0,0.0,0.0,0.0,0.0,280963,Kristoffer Askildsen,2025-05-29 04:48:06
13145,727700,11,45329296,76,Simen Kvia-Egeskog (Viking FK) Substitution at 73',Simen Kvia-Egeskog Substitution,2,4380,73',510,0,0,1980-01-01,0.0,0.0,0.0,0.0,0.0,0.0,341309,Edvin Austbø,2025-05-29 04:48:06
13145,727700,12,45329297,76,Kristoffer Askildsen (Viking FK) Substitution at 73',Kristoffer Askildsen Substitutio,2,4380,73',510,0,0,1980-01-01,0.0,0.0,0.0,0.0,0.0,0.0,380299,Jakob Segadal Hansen,2025-05-29 04:48:06
13145,727700,13,45329295,94,Zlatko Tripic (Viking FK) Yellow Card at 74',Zlatko Tripic Yellow Card,2,4440,74',510,0,0,1980-01-01,0.0,0.0,0.0,0.0,0.0,0.0,164279,Zlatko Tripic,2025-05-29 04:48:06
13145,727700,14,45329308,76,Sondre Brunstad Fet (Bodo/Glimt) Substitution at 79',Sondre Brunstad Fet Substitution,2,4740,79',2980,0,0,1980-01-01,0.0,0.0,0.0,0.0,0.0,0.0,208353,Sondre Brunstad Fet,2025-05-29 04:48:06
13145,727700,15,45329309,76,Sondre Flem Bjørnshol (Viking FK) Substitution at 79',Sondre Flem Bjørnshol Substituti,2,4740,79',510,0,0,1980-01-01,0.0,0.0,0.0,0.0,0.0,0.0,287265,Sondre Flem Bjørnshol,2025-05-29 04:48:06
13145,727700,14,45329308,76,Sondre Brunstad Fet (Bodo/Glimt) Substitution at 79',Sondre Brunstad Fet Substitution,2,4740,79',2980,0,0,1980-01-01,0.0,0.0,0.0,0.0,0.0,0.0,203670,Ulrik Saltnes,2025-05-29 04:48:06
13145,727700,15,45329309,76,Sondre Flem Bjørnshol (Viking FK) Substitution at 79',Sondre Flem Bjørnshol Substituti,2,4740,79',510,0,0,1980-01-01,0.0,0.0,0.0,0.0,0.0,0.0,303105,Herman Haugen,2025-05-29 04:48:06
13145,727700,16,45329310,76,Isak Dybvik Määttä (Bodo/Glimt) Substitution at 80',Isak Dybvik Määttä Substitution,2,4800,80',2980,0,0,1980-01-01,0.0,0.0,0.0,0.0,0.0,0.0,302019,Isak Dybvik Määttä,2025-05-29 04:48:06
13145,727700,16,45329310,76,Isak Dybvik Määttä (Bodo/Glimt) Substitution at 80',Isak Dybvik Määttä Substitution,2,4800,80',2980,0,0,1980-01-01,0.0,0.0,0.0,0.0,0.0,0.0,307798,Ole Didrik Blomberg,2025-05-29 04:48:06
13145,727700,17,45329318,70,Sondre Flem Bjørnshol (Viking FK) Goal at 83',Sondre Flem Bjørnshol Goal,2,4980,83',510,0,0,1980-01-01,0.0,0.0,0.0,0.0,0.0,0.0,287265,Sondre Flem Bjørnshol,2025-05-29 04:48:06
13145,727700,18,45329334,76,Andreas Helmersen (Bodo/Glimt) Substitution at 90',Andreas Helmersen Substitution,2,5400,90',2980,0,0,1980-01-01,0.0,0.0,0.0,0.0,0.0,0.0,218561,Andreas Helmersen,2025-05-29 04:48:06
13145,727700,19,45329336,70,Simen Kvia-Egeskog (Viking FK) Goal at 91',Simen Kvia-Egeskog Goal,2,5400,90'+1',510,0,0,1980-01-01,0.0,0.0,0.0,0.0,0.0,0.0,320678,Simen Kvia-Egeskog,2025-05-29 04:48:06
13145,727700,18,45329334,76,Andreas Helmersen (Bodo/Glimt) Substitution at 90',Andreas Helmersen Substitution,2,5400,90',2980,0,0,1980-01-01,0.0,0.0,0.0,0.0,0.0,0.0,333755,Fredrik Sjøvold,2025-05-29 04:48:06
13145,727701,1,45334322,76,Samukelo Kabini (Molde) Substitution at 10',Samukelo Kabini Substitution,1,600,10',2715,0,0,1980-01-01,0.0,0.0,0.0,0.0,0.0,0.0,366883,Samukelo Kabini,2025-05-30 04:53:26
13145,727701,1,45334322,76,Samukelo Kabini (Molde) Substitution at 10',Samukelo Kabini Substitution,1,600,10',2715,0,0,1980-01-01,0.0,0.0,0.0,0.0,0.0,0.0,173356,Kristoffer Haugen,2025-05-30 04:53:26
13145,727701,2,45334323,70,Fredrik Gulbrandsen (Molde) Goal at 11',Fredrik Gulbrandsen Goal,1,660,11',2715,0,0,1980-01-01,0.0,0.0,0.0,0.0,0.0,0.0,134827,Fredrik Gulbrandsen,2025-05-30 04:53:26
13145,727701,3,45334333,94,Fredrik Gulbrandsen (Molde) Yellow Card at 32',Fredrik Gulbrandsen Yellow Card,1,1920,32',2715,0,0,1980-01-01,0.0,0.0,0.0,0.0,0.0,0.0,134827,Fredrik Gulbrandsen,2025-05-30 04:53:26
13145,727701,4,45334336,94,Emil Breivik (Molde) Yellow Card at 39',Emil Breivik Yellow Card,1,2340,39',2715,0,0,1980-01-01,0.0,0.0,0.0,0.0,0.0,0.0,280801,Emil Breivik,2025-05-30 04:53:26
13145,727701,5,45334338,94,Mads Enggård (Molde) Yellow Card at 45',Mads Enggård Yellow Card,1,2700,45',2715,0,0,1980-01-01,0.0,0.0,0.0,0.0,0.0,0.0,315621,Mads Enggård,2025-05-30 04:53:26
13145,727701,6,45334340,94,Joachim Soltvedt (SK Brann) Yellow Card at 48',Joachim Soltvedt Yellow Card,1,2700,45'+3',620,0,0,1980-01-01,0.0,0.0,0.0,0.0,0.0,0.0,205582,Joachim Soltvedt,2025-05-30 04:53:26
13145,727701,7,45334342,76,Sondre Granaas (Molde) Substitution at 45',Sondre Granaas Substitution,2,2700,45',2715,0,0,1980-01-01,0.0,0.0,0.0,0.0,0.0,0.0,379152,Sondre Granaas,2025-05-30 04:53:26
13145,727701,7,45334342,76,Sondre Granaas (Molde) Substitution at 45',Sondre Granaas Substitution,2,2700,45',2715,0,0,1980-01-01,0.0,0.0,0.0,0.0,0.0,0.0,141189,Magnus Wolff Eikrem,2025-05-30 04:53:26
13145,727701,8,45334343,70,Kristian Eriksen (Molde) Goal at 48',Kristian Eriksen Goal,2,2880,48',2715,0,0,1980-01-01,0.0,0.0,0.0,0.0,0.0,0.0,333782,Kristian Eriksen,2025-05-30 04:53:26
13145,727701,9,45334344,94,Felix Horn Myhre (SK Brann) Yellow Card at 54',Felix Horn Myhre Yellow Card,2,3240,54',620,0,0,1980-01-01,0.0,0.0,0.0,0.0,0.0,0.0,251618,Felix Horn Myhre,2025-05-30 04:53:26
13145,727701,10,45334345,94,Jacob Karlstrom (Molde) Yellow Card at 55',Jacob Karlstrom Yellow Card,2,3300,55',2715,0,0,1980-01-01,0.0,0.0,0.0,0.0,0.0,0.0,235493,Jacob Karlstrom,2025-05-30 04:53:26
13145,727701,11,45334349,76,Veton Berisha (Molde) Substitution at 59',Veton Berisha Substitution,2,3540,59',2715,0,0,1980-01-01,0.0,0.0,0.0,0.0,0.0,0.0,162495,Veton Berisha,2025-05-30 04:53:26
13145,727701,11,45334349,76,Veton Berisha (Molde) Substitution at 59',Veton Berisha Substitution,2,3540,59',2715,0,0,1980-01-01,0.0,0.0,0.0,0.0,0.0,0.0,134827,Fredrik Gulbrandsen,2025-05-30 04:53:26
13145,727701,12,45334350,94,Samukelo Kabini (Molde) Yellow Card at 60',Samukelo Kabini Yellow Card,2,3600,60',2715,0,0,1980-01-01,0.0,0.0,0.0,0.0,0.0,0.0,366883,Samukelo Kabini,2025-05-30 04:53:26
13145,727701,13,45334351,76,Thore Baardsen Pedersen (SK Brann) Substitution at 62',Thore Baardsen Pedersen Substitu,2,3720,62',620,0,0,1980-01-01,0.0,0.0,0.0,0.0,0.0,0.0,285881,Thore Baardsen Pedersen,2025-05-30 04:53:26
13145,727701,14,45334352,76,Ulrick Mathisen (SK Brann) Substitution at 62',Ulrick Mathisen Substitution,2,3720,62',620,0,0,1980-01-01,0.0,0.0,0.0,0.0,0.0,0.0,274042,Ulrick Mathisen,2025-05-30 04:53:26
13145,727701,15,45334353,76,Lars Remmem (SK Brann) Substitution at 62',Lars Remmem Substitution,2,3720,62',620,0,0,1980-01-01,0.0,0.0,0.0,0.0,0.0,0.0,383883,Lars Remmem,2025-05-30 04:53:26
13145,727701,13,45334351,76,Thore Baardsen Pedersen (SK Brann) Substitution at 62',Thore Baardsen Pedersen Substitu,2,3720,62',620,0,0,1980-01-01,0.0,0.0,0.0,0.0,0.0,0.0,363067,Denzel De Roeve,2025-05-30 04:53:26
13145,727701,14,45334352,76,Ulrick Mathisen (SK Brann) Substitution at 62',Ulrick Mathisen Substitution,2,3720,62',620,0,0,1980-01-01,0.0,0.0,0.0,0.0,0.0,0.0,303280,Mads Sande,2025-05-30 04:53:26
13145,727701,15,45334353,76,Lars Remmem (SK Brann) Substitution at 62',Lars Remmem Substitution,2,3720,62',620,0,0,1980-01-01,0.0,0.0,0.0,0.0,0.0,0.0,321407,Eggert Aron Gudmundsson,2025-05-30 04:53:26
13145,727701,16,45334361,70,Veton Berisha (Molde) Goal at 72',Veton Berisha Goal,2,4320,72',2715,0,0,1980-01-01,0.0,0.0,0.0,0.0,0.0,0.0,162495,Veton Berisha,2025-05-30 04:53:26
13145,727701,17,45334364,94,Eirik Hestad (Molde) Yellow Card at 76',Eirik Hestad Yellow Card,2,4560,76',2715,0,0,1980-01-01,0.0,0.0,0.0,0.0,0.0,0.0,179157,Eirik Hestad,2025-05-30 04:53:26
13145,727701,18,45334367,76,Johan Bakke (Molde) Substitution at 77',Johan Bakke Substitution,2,4620,77',2715,0,0,1980-01-01,0.0,0.0,0.0,0.0,0.0,0.0,312175,Johan Bakke,2025-05-30 04:53:26
13145,727701,18,45334367,76,Johan Bakke (Molde) Substitution at 77',Johan Bakke Substitution,2,4620,77',2715,0,0,1980-01-01,0.0,0.0,0.0,0.0,0.0,0.0,179157,Eirik Hestad,2025-05-30 04:53:26
13145,727701,19,45334371,94,Eivind Helland (SK Brann) Yellow Card at 82',Eivind Helland Yellow Card,2,4920,82',620,0,0,1980-01-01,0.0,0.0,0.0,0.0,0.0,0.0,361818,Eivind Helland,2025-05-30 04:53:26
13145,727701,20,45334372,76,Markus Haaland (SK Brann) Substitution at 82',Markus Haaland Substitution,2,4920,82',620,0,0,1980-01-01,0.0,0.0,0.0,0.0,0.0,0.0,320656,Markus Haaland,2025-05-30 04:53:26
13145,727701,21,45334373,76,Mads Kristian Hansen (SK Brann) Substitution at 82',Mads Kristian Hansen Substitutio,2,4920,82',620,0,0,1980-01-01,0.0,0.0,0.0,0.0,0.0,0.0,298069,Mads Kristian Hansen,2025-05-30 04:53:26
13145,727701,20,45334372,76,Markus Haaland (SK Brann) Substitution at 82',Markus Haaland Substitution,2,4920,82',620,0,0,1980-01-01,0.0,0.0,0.0,0.0,0.0,0.0,173355,Bard Finne,2025-05-30 04:53:26
13145,727701,21,45334373,76,Mads Kristian Hansen (SK Brann) Substitution at 82',Mads Kristian Hansen Substitutio,2,4920,82',620,0,0,1980-01-01,0.0,0.0,0.0,0.0,0.0,0.0,272749,Aune Heggebo,2025-05-30 04:53:26
13145,727701,22,45334374,93,Veton Berisha (Molde) Red Card at 83',Veton Berisha Red Card,2,4980,83',2715,0,0,1980-01-01,0.0,0.0,0.0,0.0,0.0,0.0,162495,Veton Berisha,2025-05-30 04:53:26
13145,727701,23,45334378,94,Sondre Granaas (Molde) Yellow Card at 84',Sondre Granaas Yellow Card,2,5040,84',2715,0,0,1980-01-01,0.0,0.0,0.0,0.0,0.0,0.0,379152,Sondre Granaas,2025-05-30 04:53:26
13145,727701,24,45334380,94,Mads Kristian Hansen (SK Brann) Yellow Card at 89',Mads Kristian Hansen Yellow Card,2,5340,89',620,0,0,1980-01-01,0.0,0.0,0.0,0.0,0.0,0.0,298069,Mads Kristian Hansen,2025-05-30 04:53:26
13145,727701,25,45334383,93,Mads Enggård (Molde) Red Card at 91',Mads Enggård Red Card,2,5400,90'+1',2715,0,0,1980-01-01,0.0,0.0,0.0,0.0,0.0,0.0,315621,Mads Enggård,2025-05-30 04:53:26
13145,727702,1,45338202,70,Moses Mawa (Hamarkameratene) Goal at 7',Moses Mawa Goal,1,420,7',21380,0,0,1980-01-01,0.0,0.0,0.0,0.0,0.0,0.0,291198,Moses Mawa,2025-06-01 04:59:19
13145,727702,2,45338221,76,Bent Sormo (Stromsgodset) Substitution at 29',Bent Sormo Substitution,1,1740,29',9811,0,0,1980-01-01,0.0,0.0,0.0,0.0,0.0,0.0,204768,Bent Sormo,2025-06-01 04:59:19
13145,727702,2,45338221,76,Bent Sormo (Stromsgodset) Substitution at 29',Bent Sormo Substitution,1,1740,29',9811,0,0,1980-01-01,0.0,0.0,0.0,0.0,0.0,0.0,359186,Fredrik Dahl,2025-06-01 04:59:19
13145,727702,3,45338242,94,Gard Simenstad (Hamarkameratene) Yellow Card at 36',Gard Simenstad Yellow Card,1,2160,36',21380,0,0,1980-01-01,0.0,0.0,0.0,0.0,0.0,0.0,378943,Gard Simenstad,2025-06-01 04:59:19
13145,727702,4,45338255,94,Marko Lawk Farji (Stromsgodset) Yellow Card at 40',Marko Lawk Farji Yellow Card,1,2400,40',9811,0,0,1980-01-01,0.0,0.0,0.0,0.0,0.0,0.0,326032,Marko Lawk Farji,2025-06-01 04:59:19
13145,727702,5,45338278,94,Alwande Roaldsöy (Hamarkameratene) Yellow Card at 57',Alwande Roaldsöy Yellow Card,2,3420,57',21380,0,0,1980-01-01,0.0,0.0,0.0,0.0,0.0,0.0,364725,Alwande Roaldsöy,2025-06-01 04:59:19
13145,727702,6,45338279,94,Anton Ekeroth (Hamarkameratene) Yellow Card at 64',Anton Ekeroth Yellow Card,2,3840,64',21380,0,0,1980-01-01,0.0,0.0,0.0,0.0,0.0,0.0,311151,Anton Ekeroth,2025-06-01 04:59:19
13145,727702,7,45338280,76,William Osnes-Ringen (Hamarkameratene) Substitution at 67',William Osnes-Ringen Substitutio,2,4020,67',21380,0,0,1980-01-01,0.0,0.0,0.0,0.0,0.0,0.0,380622,William Osnes-Ringen,2025-06-01 04:59:19
13145,727702,8,45338281,76,Vidar Ari Jonsson (Hamarkameratene) Substitution at 67',Vidar Ari Jonsson Substitution,2,4020,67',21380,0,0,1980-01-01,0.0,0.0,0.0,0.0,0.0,0.0,252810,Vidar Ari Jonsson,2025-06-01 04:59:19
13145,727702,7,45338280,76,William Osnes-Ringen (Hamarkameratene) Substitution at 67',William Osnes-Ringen Substitutio,2,4020,67',21380,0,0,1980-01-01,0.0,0.0,0.0,0.0,0.0,0.0,378943,Gard Simenstad,2025-06-01 04:59:19
13145,727702,8,45338281,76,Vidar Ari Jonsson (Hamarkameratene) Substitution at 67',Vidar Ari Jonsson Substitution,2,4020,67',21380,0,0,1980-01-01,0.0,0.0,0.0,0.0,0.0,0.0,311151,Anton Ekeroth,2025-06-01 04:59:19
13145,727702,9,45338284,70,Tore Andre Soras (Hamarkameratene) Goal at 71',Tore Andre Soras Goal,2,4260,71',21380,0,0,1980-01-01,0.0,0.0,0.0,0.0,0.0,0.0,260786,Tore Andre Soras,2025-06-01 04:59:19
13145,727702,10,45338285,70,Moses Mawa (Hamarkameratene) Goal at 73',Moses Mawa Goal,2,4380,73',21380,0,0,1980-01-01,0.0,0.0,0.0,0.0,0.0,0.0,291198,Moses Mawa,2025-06-01 04:59:19
13145,727702,11,45338293,76,Julian Gonstad (Hamarkameratene) Substitution at 82',Julian Gonstad Substitution,2,4920,82',21380,0,0,1980-01-01,0.0,0.0,0.0,0.0,0.0,0.0,333793,Julian Gonstad,2025-06-01 04:59:19
13145,727702,12,45338296,76,Ole Kristian Enersen (Stromsgodset) Substitution at 82',Ole Kristian Enersen Substitutio,2,4920,82',9811,0,0,1980-01-01,0.0,0.0,0.0,0.0,0.0,0.0,318432,Ole Kristian Enersen,2025-06-01 04:59:19
13145,727702,13,45338297,76,Logi Tomasson (Stromsgodset) Substitution at 82',Logi Tomasson Substitution,2,4920,82',9811,0,0,1980-01-01,0.0,0.0,0.0,0.0,0.0,0.0,305194,Logi Tomasson,2025-06-01 04:59:19
13145,727702,14,45338298,76,Samuel Silalahi (Stromsgodset) Substitution at 82',Samuel Silalahi Substitution,2,4920,82',9811,0,0,1980-01-01,0.0,0.0,0.0,0.0,0.0,0.0,352557,Samuel Silalahi,2025-06-01 04:59:19
13145,727702,11,45338293,76,Julian Gonstad (Hamarkameratene) Substitution at 82',Julian Gonstad Substitution,2,4920,82',21380,0,0,1980-01-01,0.0,0.0,0.0,0.0,0.0,0.0,291198,Moses Mawa,2025-06-01 04:59:19
13145,727702,12,45338296,76,Ole Kristian Enersen (Stromsgodset) Substitution at 82',Ole Kristian Enersen Substitutio,2,4920,82',9811,0,0,1980-01-01,0.0,0.0,0.0,0.0,0.0,0.0,168749,Lars-Christopher Vilsvik,2025-06-01 04:59:19
13145,727702,13,45338297,76,Logi Tomasson (Stromsgodset) Substitution at 82',Logi Tomasson Substitution,2,4920,82',9811,0,0,1980-01-01,0.0,0.0,0.0,0.0,0.0,0.0,379600,Sivert Westerlund,2025-06-01 04:59:19
13145,727702,14,45338298,76,Samuel Silalahi (Stromsgodset) Substitution at 82',Samuel Silalahi Substitution,2,4920,82',9811,0,0,1980-01-01,0.0,0.0,0.0,0.0,0.0,0.0,343805,Jonas Therkelsen,2025-06-01 04:59:19
13145,727702,15,45338299,76,Aksel Potur (Hamarkameratene) Substitution at 86',Aksel Potur Substitution,2,5160,86',21380,0,0,1980-01-01,0.0,0.0,0.0,0.0,0.0,0.0,369973,Aksel Potur,2025-06-01 04:59:19
13145,727702,15,45338299,76,Aksel Potur (Hamarkameratene) Substitution at 86',Aksel Potur Substitution,2,5160,86',21380,0,0,1980-01-01,0.0,0.0,0.0,0.0,0.0,0.0,364725,Alwande Roaldsöy,2025-06-01 04:59:19
13145,727702,16,45338301,76,Olav Dobloug Mengshoel (Hamarkameratene) Substitution at 87',Olav Dobloug Mengshoel Substitut,2,5220,87',21380,0,0,1980-01-01,0.0,0.0,0.0,0.0,0.0,0.0,387382,Olav Dobloug Mengshoel,2025-06-01 04:59:19
13145,727702,16,45338301,76,Olav Dobloug Mengshoel (Hamarkameratene) Substitution at 87',Olav Dobloug Mengshoel Substitut,2,5220,87',21380,0,0,1980-01-01,0.0,0.0,0.0,0.0,0.0,0.0,300052,Kristian Stromland Lien,2025-06-01 04:59:19
13145,727703,1,45338442,94,David Edvardsson (Tromso) Yellow Card at 21',David Edvardsson Yellow Card,1,1260,21',5270,0,0,1980-01-01,0.0,0.0,0.0,0.0,0.0,0.0,312875,David Edvardsson,2025-06-01 04:59:19
13145,727703,2,45338469,76,Håkon Sjåtil (Valerenga) Substitution at 32',Håkon Sjåtil Substitution,1,1920,32',2791,0,0,1980-01-01,0.0,0.0,0.0,0.0,0.0,0.0,379439,Håkon Sjåtil,2025-06-01 04:59:19
13145,727703,2,45338469,76,Håkon Sjåtil (Valerenga) Substitution at 32',Håkon Sjåtil Substitution,1,1920,32',2791,0,0,1980-01-01,0.0,0.0,0.0,0.0,0.0,0.0,129267,Vegar Hedenstad,2025-06-01 04:59:19
13145,727703,3,45338619,70,David Edvardsson (Tromso) Goal at 52',David Edvardsson Goal,2,3120,52',5270,0,0,1980-01-01,0.0,0.0,0.0,0.0,0.0,0.0,312875,David Edvardsson,2025-06-01 04:59:19
13145,727703,4,45338622,94,Vinícius Nogueira (Valerenga) Yellow Card at 54',Vinícius Nogueira Yellow Card,2,3240,54',2791,0,0,1980-01-01,0.0,0.0,0.0,0.0,0.0,0.0,357210,Vinícius Nogueira,2025-06-01 04:59:19
13145,727703,5,45338645,94,Fidele Brice Ambina (Valerenga) Yellow Card at 63',Fidele Brice Ambina Yellow Card,2,3780,63',2791,0,0,1980-01-01,0.0,0.0,0.0,0.0,0.0,0.0,335757,Fidele Brice Ambina,2025-06-01 04:59:19
13145,727703,6,45338646,76,Mees Rijks (Valerenga) Substitution at 63',Mees Rijks Substitution,2,3780,63',2791,0,0,1980-01-01,0.0,0.0,0.0,0.0,0.0,0.0,312358,Mees Rijks,2025-06-01 04:59:19
13145,727703,6,45338646,76,Mees Rijks (Valerenga) Substitution at 63',Mees Rijks Substitution,2,3780,63',2791,0,0,1980-01-01,0.0,0.0,0.0,0.0,0.0,0.0,309265,Muamer Brajanac,2025-06-01 04:59:19
13145,727703,7,45338647,76,Stian Thorstensen (Valerenga) Substitution at 64',Stian Thorstensen Substitution,2,3840,64',2791,0,0,1980-01-01,0.0,0.0,0.0,0.0,0.0,0.0,358083,Stian Thorstensen,2025-06-01 04:59:19
13145,727703,7,45338647,76,Stian Thorstensen (Valerenga) Substitution at 64',Stian Thorstensen Substitution,2,3840,64',2791,0,0,1980-01-01,0.0,0.0,0.0,0.0,0.0,0.0,290110,Elias Hagen,2025-06-01 04:59:19
13145,727703,8,45338657,94,Vetle Skjaervik (Tromso) Yellow Card at 66',Vetle Skjaervik Yellow Card,2,3960,66',5270,0,0,1980-01-01,0.0,0.0,0.0,0.0,0.0,0.0,333783,Vetle Skjaervik,2025-06-01 04:59:19
13145,727703,9,45338664,70,Elias Sörensen (Valerenga) Goal at 67',Elias Sörensen Goal,2,4020,67',2791,0,0,1980-01-01,0.0,0.0,0.0,0.0,0.0,0.0,279756,Elias Sörensen,2025-06-01 04:59:19
13145,727703,10,45338669,70,Vegard Østraat Erlien (Tromso) Goal at 68',Vegard Østraat Erlien Goal,2,4080,68',5270,0,0,1980-01-01,0.0,0.0,0.0,0.0,0.0,0.0,293362,Vegard Østraat Erlien,2025-06-01 04:59:19
13145,727703,11,45338682,76,Ieltsin Camões (Tromso) Substitution at 69',Ieltsin Camões Substitution,2,4140,69',5270,0,0,1980-01-01,0.0,0.0,0.0,0.0,0.0,0.0,400376,Ieltsin Camões,2025-06-01 04:59:19
13145,727703,12,45338683,76,Kent-Are Antonsen (Tromso) Substitution at 69',Kent-Are Antonsen Substitution,2,4140,69',5270,0,0,1980-01-01,0.0,0.0,0.0,0.0,0.0,0.0,187920,Kent-Are Antonsen,2025-06-01 04:59:19
13145,727703,11,45338682,76,Ieltsin Camões (Tromso) Substitution at 69',Ieltsin Camões Substitution,2,4140,69',5270,0,0,1980-01-01,0.0,0.0,0.0,0.0,0.0,0.0,359500,Jakob Romsaas,2025-06-01 04:59:19
13145,727703,12,45338683,76,Kent-Are Antonsen (Tromso) Substitution at 69',Kent-Are Antonsen Substitution,2,4140,69',5270,0,0,1980-01-01,0.0,0.0,0.0,0.0,0.0,0.0,354149,Jens Hjerto Dahl,2025-06-01 04:59:19
13145,727703,13,45338681,94,Abubacarr Kinteh (Tromso) Yellow Card at 71',Abubacarr Kinteh Yellow Card,2,4260,71',5270,0,0,1980-01-01,0.0,0.0,0.0,0.0,0.0,0.0,401339,Abubacarr Kinteh,2025-06-01 04:59:19
13145,727703,14,45338705,76,Yaw Paintsil (Tromso) Substitution at 77',Yaw Paintsil Substitution,2,4620,77',5270,0,0,1980-01-01,0.0,0.0,0.0,0.0,0.0,0.0,358392,Yaw Paintsil,2025-06-01 04:59:19
