seasonType,eventId,playOrder,playId,typeId,text,shortText,period,clockValue,clockDisplayValue,teamId,scoringPlay,shootout,wallclock,goalPositionX,goalPositionY,fieldpositionX,fieldPositionY,fieldPosition2X,fieldPosition2Y,athleteId,participant,updateDateTime
13145,727708,17,45344198,76,Haakon Haugen (Kristiansund BK) Substitution at 90',Haakon Haugen Substitution,2,5400,90',6672,0,0,1980-01-01,0.0,0.0,0.0,0.0,0.0,0.0,306519,Ian Hoffman,2025-06-02 04:54:51
13145,727708,18,45344208,76,Rasmus Holten (SK Brann) Substitution at 94',Rasmus Holten Substitution,2,5400,90'+4',620,0,0,1980-01-01,0.0,0.0,0.0,0.0,0.0,0.0,205582,Joachim Soltvedt,2025-06-02 04:54:51
13145,727709,1,45344236,70,Henrik Sælebakke Falchener (Viking FK) Goal at 3',Henrik Sælebakke Falchener Goal,1,180,3',510,0,0,1980-01-01,0.0,0.0,0.0,0.0,0.0,0.0,303281,Henrik Sælebakke Falchener,2025-06-03 04:51:43
13145,727709,2,45344259,76,Christian Cappis (Viking FK) Substitution at 17',Christian Cappis Substitution,1,1020,17',510,0,0,1980-01-01,0.0,0.0,0.0,0.0,0.0,0.0,283864,Christian Cappis,2025-06-03 04:51:43
13145,727709,2,45344259,76,Christian Cappis (Viking FK) Substitution at 17',Christian Cappis Substitution,1,1020,17',510,0,0,1980-01-01,0.0,0.0,0.0,0.0,0.0,0.0,186248,Sander Svendsen,2025-06-03 04:51:43
13145,727709,3,45344262,76,Markus Kaasa (Molde) Substitution at 20',Markus Kaasa Substitution,1,1200,20',2715,0,0,1980-01-01,0.0,0.0,0.0,0.0,0.0,0.0,245962,Markus Kaasa,2025-06-03 04:51:43
13145,727709,3,45344262,76,Markus Kaasa (Molde) Substitution at 20',Markus Kaasa Substitution,1,1200,20',2715,0,0,1980-01-01,0.0,0.0,0.0,0.0,0.0,0.0,320917,Valdemar Lund Jensen,2025-06-03 04:51:43
13145,727709,4,45344289,94,Eirik Haugan (Molde) Yellow Card at 30',Eirik Haugan Yellow Card,1,1800,30',2715,0,0,1980-01-01,0.0,0.0,0.0,0.0,0.0,0.0,205140,Eirik Haugan,2025-06-03 04:51:43
13145,727709,5,45344398,94,Halldor Stenevik (Molde) Yellow Card at 51',Halldor Stenevik Yellow Card,2,3060,51',2715,0,0,1980-01-01,0.0,0.0,0.0,0.0,0.0,0.0,240684,Halldor Stenevik,2025-06-03 04:51:43
13145,727709,6,45344407,76,Eirik Hestad (Molde) Substitution at 58',Eirik Hestad Substitution,2,3480,58',2715,0,0,1980-01-01,0.0,0.0,0.0,0.0,0.0,0.0,179157,Eirik Hestad,2025-06-03 04:51:43
13145,727709,6,45344407,76,Eirik Hestad (Molde) Substitution at 58',Eirik Hestad Substitution,2,3480,58',2715,0,0,1980-01-01,0.0,0.0,0.0,0.0,0.0,0.0,333782,Kristian Eriksen,2025-06-03 04:51:43
13145,727709,7,45344419,76,Kristoffer Askildsen (Viking FK) Substitution at 71',Kristoffer Askildsen Substitutio,2,4260,71',510,0,0,1980-01-01,0.0,0.0,0.0,0.0,0.0,0.0,280963,Kristoffer Askildsen,2025-06-03 04:51:43
13145,727709,8,45344420,76,Herman Haugen (Viking FK) Substitution at 71',Herman Haugen Substitution,2,4260,71',510,0,0,1980-01-01,0.0,0.0,0.0,0.0,0.0,0.0,303105,Herman Haugen,2025-06-03 04:51:43
13145,727709,7,45344419,76,Kristoffer Askildsen (Viking FK) Substitution at 71',Kristoffer Askildsen Substitutio,2,4260,71',510,0,0,1980-01-01,0.0,0.0,0.0,0.0,0.0,0.0,164279,Zlatko Tripic,2025-06-03 04:51:43
13145,727709,8,45344420,76,Herman Haugen (Viking FK) Substitution at 71',Herman Haugen Substitution,2,4260,71',510,0,0,1980-01-01,0.0,0.0,0.0,0.0,0.0,0.0,341309,Edvin Austbø,2025-06-03 04:51:43
13145,727709,9,45344421,76,Johan Bakke (Molde) Substitution at 73',Johan Bakke Substitution,2,4380,73',2715,0,0,1980-01-01,0.0,0.0,0.0,0.0,0.0,0.0,312175,Johan Bakke,2025-06-03 04:51:43
13145,727709,10,45344422,76,Casper Oyvann (Molde) Substitution at 73',Casper Oyvann Substitution,2,4380,73',2715,0,0,1980-01-01,0.0,0.0,0.0,0.0,0.0,0.0,287290,Casper Oyvann,2025-06-03 04:51:43
13145,727709,11,45344423,76,Daniel Daga (Molde) Substitution at 73',Daniel Daga Substitution,2,4380,73',2715,0,0,1980-01-01,0.0,0.0,0.0,0.0,0.0,0.0,362269,Daniel Daga,2025-06-03 04:51:43
13145,727709,12,45344424,94,Herman Haugen (Viking FK) Yellow Card at 73',Herman Haugen Yellow Card,2,4380,73',510,0,0,1980-01-01,0.0,0.0,0.0,0.0,0.0,0.0,303105,Herman Haugen,2025-06-03 04:51:43
13145,727709,9,45344421,76,Johan Bakke (Molde) Substitution at 73',Johan Bakke Substitution,2,4380,73',2715,0,0,1980-01-01,0.0,0.0,0.0,0.0,0.0,0.0,141189,Magnus Wolff Eikrem,2025-06-03 04:51:43
13145,727709,10,45344422,76,Casper Oyvann (Molde) Substitution at 73',Casper Oyvann Substitution,2,4380,73',2715,0,0,1980-01-01,0.0,0.0,0.0,0.0,0.0,0.0,303279,Isak Helstad Amundsen,2025-06-03 04:51:43
13145,727709,11,45344423,76,Daniel Daga (Molde) Substitution at 73',Daniel Daga Substitution,2,4380,73',2715,0,0,1980-01-01,0.0,0.0,0.0,0.0,0.0,0.0,134827,Fredrik Gulbrandsen,2025-06-03 04:51:43
13145,727709,13,45344430,113,Peter Christiansen (Viking FK) Penalty - Missed at 78',Peter Christiansen Penalty - Mis,2,4680,78',510,0,0,1980-01-01,0.0,0.0,0.0,0.0,0.0,0.0,9167,Peter Christiansen,2025-06-03 04:51:43
13145,727709,14,45344437,76,Sondre Flem Bjørnshol (Viking FK) Substitution at 85',Sondre Flem Bjørnshol Substituti,2,5100,85',510,0,0,1980-01-01,0.0,0.0,0.0,0.0,0.0,0.0,287265,Sondre Flem Bjørnshol,2025-06-03 04:51:43
13145,727709,15,45344440,76,Hilmir Rafn Mikaelsson (Viking FK) Substitution at 85',Hilmir Rafn Mikaelsson Substitut,2,5100,85',510,0,0,1980-01-01,0.0,0.0,0.0,0.0,0.0,0.0,341337,Hilmir Rafn Mikaelsson,2025-06-03 04:51:43
13145,727709,14,45344437,76,Sondre Flem Bjørnshol (Viking FK) Substitution at 85',Sondre Flem Bjørnshol Substituti,2,5100,85',510,0,0,1980-01-01,0.0,0.0,0.0,0.0,0.0,0.0,380299,Jakob Segadal Hansen,2025-06-03 04:51:43
13145,727709,15,45344440,76,Hilmir Rafn Mikaelsson (Viking FK) Substitution at 85',Hilmir Rafn Mikaelsson Substitut,2,5100,85',510,0,0,1980-01-01,0.0,0.0,0.0,0.0,0.0,0.0,9167,Peter Christiansen,2025-06-03 04:51:43
13145,727709,16,45344473,94,Kristoffer Askildsen (Viking FK) Yellow Card at 89',Kristoffer Askildsen Yellow Card,2,5340,89',510,0,0,1980-01-01,0.0,0.0,0.0,0.0,0.0,0.0,280963,Kristoffer Askildsen,2025-06-03 04:51:43
